Title,Author(s),Journal,Year,# times Cited (Papers),# times Cited (Patents),URL,Affiliations,Countries,Abstract
Unlimited High Breakdown Voltage by Natural Super Junction of Polarized Semiconductor,"[""Hidetoshi Ishida"", ""Daisuke Shibata"", ""Manabu Yanagihara"", ""Yasuhiro Uemoto"", ""Hisayoshi Matsuo"", ""Tetsuzo Ueda"", ""Tsuyoshi Tanaka"", ""Daisuke Ueda""]",IEEE Electron Device Letters,2008,50,9,https://ieeexplore.ieee.org/document/4631459/,"[""Advanced Technology Research Laboratories, Matsushita Elecrric Indusrrial Company Limited, Kyoto, Japan"", ""Semiconductor Device Research Center, Semiconductor Company, Matsushita Elecrric Indusrrial Company Limited, Kyoto, Japan""]","[""Japan""]","A breakdown mechanism of polarized semiconductors represented by GaN-based materials is presented, based on the concept of a natural super junction, which is established by the inherent material polarization. In this concept, owing to the precise matching of positive and negative polarizations of both sides of GaN and AlGaN materials, average charge concentration in the material becomes nearly zero under reverse bias condition, which realizes extremely high breakdown voltage. This model is confirmed by device simulation taking all polarization charges of GaN-based materials into account. Furthermore, experimentally fabricated GaN-based Schottky barrier diodes showed a linear increase of breakdown voltage along the anode-cathode spacing, achieving a record breakdown voltage over 9000 V."
"Growth Parameter Dependence of Structural Characterizations of Diluted Magnetic Semiconductor (Ga, Cr)As","[""J. Lu"", ""J. F. Bi"", ""W. Z. Wang"", ""H. D. Gan"", ""H. J. Meng"", ""J. J. Deng"", ""H. Z. Zheng"", ""J. H. Zhao""]",IEEE Transactions on Magnetics,2008,9,0,https://ieeexplore.ieee.org/document/4717502/,"[""State Key Laboratory for Superlattices and Microstructures, Institute of Semiconductors, Chinese Academy and Sciences, Beijing, China""]","[""China""]","We report the influence of growth parameters and post-growth annealing on the structural characterizations and magnetic properties of (Ga, Cr)As films. The crystalline quality and magnetic properties are sensitive to the growth conditions. The single-phase (Ga, Cr)As film with the Curie temperature of 10 K is synthesized at growth temperature T s = 250degC and with nominal Cr content x = 0.016 . However, for the films with x > 0.02, the aggregation of Cr atoms is strongly enhanced as both T s and x increase, which not only brings strong compressive strain in the epilayer, but also roughens the surface. The origin of room-temperature ferromagnetism in (Ga, Cr)As films with nanoclusters is also discussed."
High-Efficiency 808-nm InGaAlAs–AlGaAs Double-Quantum-Well Semiconductor Lasers With Asymmetric Waveguide Structures,"[""Lin Li"", ""Guojun Liu"", ""Zhanguo Li"", ""Mei Li"", ""Hui Li"", ""Xiaohua Wang"", ""Chunming Wan""]",IEEE Photonics Technology Letters,2008,29,0,https://ieeexplore.ieee.org/document/4472048/,"[""National Key Laboratory of High Power Semiconductor Lasers, Changchun University of Science and Technology, Changchun, China""]","[""China""]","The InGaAlAs-AlGaAs double-quantum-well semiconductor lasers grown by molecular beam epitaxy show high quantum efficiency and high power conversion efficiency at continuous-wave power output using asymmetric waveguide structures. The threshold current density and slope efficiency of the device are 180 A/cm 2 and 1.4 W/A, respectively. The internal loss and the internal quantum efficiency are 1.1 cm -1 and 97%, respectively. The 75% maximum power conversion efficiency is achieved in 100-mum stripe widths 808-nm-emitting laser diodes with 1000-mum cavity length."
A GaAs-Based Hybrid Integration of a Tunneling Diode and a 1060-nm Semiconductor Laser,"[""Junping Mi"", ""Hongyan Yu"", ""Huolei Wang"", ""Shaoyang Tan"", ""Weixi Chen"", ""Ying Ding"", ""Jiaoqing Pan""]",IEEE Photonics Technology Letters,2015,8,0,https://ieeexplore.ieee.org/document/6930721/,"[""Key Laboratory of Semiconductor Materials Science, Institute of Semiconductors, Chinese Academy of Sciences, Beijing, China"", ""School of Engineering, University of Glasgow, Glasgow, U.K."", ""State Key Laboratory for Mesoscopic Physics, School of Physics, Peking University, Beijing, China""]","[""China"", ""UK""]","We report on a hybrid integrated tunneling diode, with a simple structure, and a quantum well laser diode, lasing at ~1060 nm, on GaAs substrate. The low-frequency operation of the integrated circuit was measured and obvious negative differential resistance regions were shown in the electrical and optical output. The electrical and optical bistability were measured, and the peak and valley voltage were 2.03 and 2.17 V, respectively. A 140-mV-wide hysteresis loop and an optical on/off ratio of 21 dB were obtained. The device has potential applications in biomedicine and optical interconnects."
30-Gbps Directly Modulated Semiconductor Lasers Based on Surface High-Order Gratings,"[""Pijie Ma"", ""Yufei Jia"", ""Anjin Liu"", ""Jingxuan Chen"", ""Mingjin Wang"", ""Jing Li"", ""Wanhua Zheng""]",IEEE Photonics Technology Letters,2021,5,0,https://ieeexplore.ieee.org/document/9316752/,"[""Key Laboratory of Solid-State Optoelectronics Information Technology, Institute of Semiconductors, Chinese Academy of Sciences, Beijing, China""]","[""China""]","Semiconductor lasers with surface high-order gratings have been fabricated and measured.31st-order gratings were defined by the standard contact-type i-line photolithography near the front facet and subsequently etched into the ridges of the semiconductor lasers by the inductively coupled plasma. Both the static and dynamic characteristics were investigated. The threshold current and maximum output power are 22 mA and 12 mW, respectively. Side-mode suppression ratios are larger than 35 dB at bias currents except approximately 145 mA due to mode hopping. −3 dB bandwidth of the small signal response is 13.8 GHz at 130 mA. The eye diagram at a bit rate of 30 Gbps is clearly open."
How Target Physical Properties Affect Thin-Body Semiconductor Doping When Using Energetic Ions: A Modeling-Based Analysis,"[""Maryam Shayesteh"", ""Ray Duffy""]",IEEE Transactions on Semiconductor Manufacturing,2015,2,0,https://ieeexplore.ieee.org/document/7172537/,"[""Tyndall National Institute, University College Cork, Cork, Ireland""]","[""Ireland""]","In this paper, the authors investigate how target sputtering, dose retention, and damage formation is generated in thin-body semiconductors by means of energetic ion impacts. The problems associated with ion implanting or plasma doping Si thin-bodies are well documented, however, it is not clear how changing the target material to other semiconductors currently being considering for multi-gate field-effect transistor devices will counteract or enhance these effects. By means of binary collision approximation based modeling with the Stopping and Range of Ions in Matter (SRIM) software, we explore the consequences of different target atomic density, lattice density, surface binding energies, and lattice binding energies on target sputtering, dose retention, and damage formation."
Lossless electroabsorption modulator monolithically integrated with a semiconductor optical amplifier and dual-waveguide spot-size converters,"[""Lianping Hou"", ""Hongliang Zhu"", ""Fan Zhou"", ""Lufeng Wang"", ""Jing Bian"", ""Wei Wang""]",IEEE Photonics Technology Letters,2005,7,1,https://ieeexplore.ieee.org/document/1471759/,"[""National Research Center for Optoelectronic Technology, Institute of Semiconductors, Chinese Academy and Sciences, Beijing, China""]","[""China""]","Semiconductor optical amplifier and electroabsorption modulator monolithically integrated with dual-waveguide spot-size converters at the input and output ports is demonstrated by means of selective area growth, quantum-well intermixing, and asymmetric twin waveguide technologies. At the wavelength range of 1550/spl sim/1600 nm, lossless operation with extinction ratios of 25-dB dc and 11.8-dB radio frequency and more than 10-GHz 3-dB modulation bandwidth is successfully achieved. The output beam divergence angles of the device in the horizontal and vertical directions are as small as 7.3/spl deg//spl times/10.6/spl deg/, respectively, resulting in 3.0-dB coupling loss with cleaved single-mode optical fiber."
High-Power Semiconductor Laser Fabricated by Standard Photolithography for Direct Modulation,"[""Jing Li"", ""Xueyou Wang"", ""Yuanbo Xu"", ""Fengxin Dong"", ""Fangling Du"", ""Hailing Wang"", ""Wanhua Zheng""]",IEEE Photonics Technology Letters,2023,1,0,https://ieeexplore.ieee.org/document/10029874/,"[""Key Laboratory of Solid-State Optoelectronics Information Technology, Institute of Semiconductors, Chinese Academy of Sciences, Beijing, China"", ""Weifang Academy of Advanced Optoelectronic Circuits, Shandong, Weifang, China""]","[""China""]","High-power semiconductor laser with an integrated master oscillator power amplifier (MOPA) based on the surface-slotted structure is demonstrated. The lasing wavelength of1.5 μmis achieved by using a group of micron-level slots fabricated by standard photolithography. The laser exhibits continuous-wave output power of up to 225 mW in the single-mode operation at room temperature. At the maximum output power, the modulation bandwidth is larger than 7 GHz, demonstrating the excellent performance of the MOPA based on the surface-slotted structure."
Discretely Tunable Semiconductor Lasers Suitable for Photonic Integration,"[""Diarmuid C. Byrne"", ""Jan Peter Engelstaedter"", ""Wei-Hua Guo"", ""Qiao Yin Lu"", ""Brian Corbett"", ""Brendan Roycroft"", ""James O'Callaghan"", ""F. H. Peters"", ""John F. Donegan""]",IEEE Journal of Selected Topics in Quantum Electronics,2009,57,0,https://ieeexplore.ieee.org/document/4926148/,"[""Centre for Telecommunication Value Driven Research (CTVR), Tyndall National Institute, Cork, Ireland"", ""Physics Department, University College Cork, Cork, Ireland"", ""Semiconductor Photonics Group, School of Physics and Centre for Telecommunication Value Driven Research (CTVR), Trinity College Dublin, Dublin, Ireland""]","[""Ireland""]",A sequence of partially reflective slots etched into an active ridge waveguide of a 1.5 mum laser structure is found to provide sufficient reflection for lasing. Mirrors based on these reflectors have strong spectral dependence. Two such active mirrors together with an active central section are combined in a Vernier configuration to demonstrate a tunable laser exhibiting 11 discrete modes over a 30 nm tuning range with mode spacing around 400 GHz and side-mode suppression ratio larger than 30 dB. The individual modes can be continuously tuned by up to 1.1 nm by carrier injection and by over 2 nm using thermal effects. These mirrors are suitable as a platform for integration of other optical functions with the laser. This is demonstrated by monolithically integrating a semiconductor optical amplifier with the laser resulting in a maximum channel power of 14.2 dBm from the discrete modes.
Low-Cost AWG-Based Fundamental Frequency Mode-Locked Semiconductor Laser for Multichannel Synchronous Ultrashort Pulse Generation,"[""Songtao Liu"", ""Xilin Zhang"", ""Wei Wang"", ""Lingjuan Zhao"", ""Qiang Kan"", ""Dan Lu"", ""Ruikang Zhang"", ""Chen Ji""]",IEEE Photonics Journal,2016,0,0,https://ieeexplore.ieee.org/document/7565538/,"[""Key Laboratory of Semiconductor Materials Science, Institute of Semiconductors, Chinese Academy of Sciences, Beijing, China""]","[""China""]","Impact Statement:Synchronized multichannel mode-locked laser sources with a relatively low repetition frequency but high channel count are of great interest as ideal ultrashort optical sources for future optical applications. We report our recent progress on developing a cost-effective synchronized multichannel mode-locked semiconductor laser based on a flat-top spectral response arrayed waveguide grating working in the fundamental mode-locking regime with a repetition rate of 4.1 GHz.We report a low-cost arrayed waveguide grating (AWG) based mode-locked semiconductor laser designed for multichannel synchronous ultrashort pulse generation. Both the fabrication process and chip characterization results are discussed in detail. By deploying a bundle active-passive photonic integration technique, only one regrowth step is required to monolithically integrate a semiconductor optical amplifier array, an AWG, and a common saturable absorber on a single InP substrate. Combined with a shallow ridge waveguide structure common for both active and passive sections and formed in a single dry etching process, our process allows the fabrication of the monolithic photonic integrated circuit chip in a much simplified process. The fabricated device demonstrated multichannel mode-locking operation at a repetition frequency of 4.1 GHz in a fundamental mode-locking regime under both passive mode-locking and synchronous hybrid mode-locking conditions. Timing jitter as low as 1 ps was obtained, and preliminary pulse chirping characteristics were analyzed by a frequency-resolved optical gating technique. The exhibited performance makes our device a promising candidate as a multichannel ultrashort pulse optical source for future cost-effective high-speed optical networking and signal processing applications."
Present Status of the Microstructured Semiconductor Neutron Detector-Based Direct Helium-3 Replacement,"[""Taylor R. Ochs"", ""Steven L. Bellinger"", ""Ryan. G. Fronk"", ""Luke C. Henson"", ""David E. Huddleston"", ""Zoairia I. Lyric"", ""J. Kenneth Shultis"", ""Colten T. Smith"", ""Timothy J. Sobering"", ""Douglas S. McGregor""]",IEEE Transactions on Nuclear Science,2017,9,0,https://ieeexplore.ieee.org/document/7817837/,"[""Semiconductor Materials and Radiological Technologies Laboratory, Kansas State University, Manhattan, KS, USA"", ""Electronics Design Laboratory, Kansas State University, Manhattan, KS, USA"", ""Radiation Detection Technologies, Inc., Manhattan, KS, USA""]","[""United States""]","A small form-factor, third-generation microstructured semiconductor neutron detector (MSND)-based 3 He replacement (HeRep Mk III) detector has been developed to serve as a direct replacement to expensive small-diameter, high-pressure 3 He gas-filled proportional neutron counters. Previously, the larger, 2-in diameter by 6-in-long HeRep Mk II utilized thirty 4-cm 2 active area single-sided MSNDs to replace a similarly sized 4-atm 3 He counter. The net count rate of the HeRep Mk II was 95.15% ± 9.04% of the net count rate of a similarly sized 4-atm 3 He detector for bare 252 Cf at a distance of 1 m. The HeRep Mk II net count rate measured 102.71% ±2.65% of the 3 He detector net count rate when each were placed in 6-in diameter by 9-in-long cylindrical high-density polyethylene (HDPE) moderator casks. The HeRep Mk III was developed as a test bed for new-generation dual-sided MSNDs (DSMSNDs), as well as for reduced-power electronics. The 0.75-in diameter by 4.50-in-long HeRep Mk III was populated with twelve 1-cm 2 active area DSMSNDs. The pvp-type diodes have thus far realized 53.54% ± 0.61% intrinsic thermal-neutron detection efficiency. The HeRep Mk III was tested against a 0.75-in diameter by 3.0-in-long 10-atm 3 He detector with a 30-ng 252 Cf source at a distance of 0.25 m. The HeRep Mk III reported 45.4% ± 0.3% and 56.7% ± 0.2% of the count rate of the 10-atm 3 He detector for detectors with no exterior moderator and in a 3-in by 5.75-in cylindrical HDPE moderator cask, respectively. The HeRep Mk III gamma-ray sensitivity was measured at a dose rate of 50 mR/hr from 137 Cs resulting in a net count rate of 0.01 cps, which corresponds to a gamma-ray rejection ratio of approximately 5:10 7 ."
Tunable Semiconductor Laser Based on Surface High-Order Bragg Gratings With 62 × 50 GHz Wavelength Tuning,"[""Fangling Du"", ""Anjin Liu"", ""Hailing Wang"", ""Yuanbo Xu"", ""Jing Li"", ""Wanhua Zheng""]",IEEE Photonics Technology Letters,2022,0,0,https://ieeexplore.ieee.org/document/9856633/,"[""Key Laboratory of Solid-State Optoelectronics Information Technology, Institute of Semiconductors, Chinese Academy of Sciences, Beijing, China"", ""Center of Materials Science and Optoelectronics Engineering, University of Chinese Academy of Sciences, Beijing, China""]","[""China""]","A tunable semiconductor laser based on surface high-order Bragg gratings with 50 GHz channel spacing is demonstrated for the first time. The tunable semiconductor laser can cover 62 channels at 25 °C, and the side mode suppression ratio (SMSR) of each channel is larger than 34 dB. To achieve such properties, the number, depth and periods of the slots of the tunable semiconductor laser are optimized by the 2-D scattering matrix method (SMM) to obtain denser reflection peaks with smaller full width at half maximum (FWHM) and higher reflectivity. The tunable semiconductor laser can be widely used in dense wavelength division multiplexing (DWDM) systems and can provide a promising light source for photonic integrated circuits."
Investigating the Properties of a New Lateral 4H-SiC Photoconductive Semiconductor Switch With a Stacked Structure,"[""Huiru Sha"", ""Longfei Xiao"", ""Chongbiao Luan"", ""Xun Sun"", ""Yan Qin"", ""Zhuoyun Feng"", ""Yangfan Li"", ""Jian Jiao"", ""Xiufang Chen"", ""Hongtao Li"", ""Xiangang Xu""]",IEEE Electron Device Letters,2023,0,0,https://ieeexplore.ieee.org/document/10239504/,"[""Institute of Fluid Physics, China Academy of Engineering Physics, Mianyang, China"", ""State Key Laboratory of Crystal Materials, and the Institute of Novel Semiconductors, Shandong University, Jinan, China""]","[""China""]","In this work, a new lateral photoconductive semiconductor switch (PCSS) based on high purity 4H Silicon Carbide (4H-SiC) was presented composed of a stack structure with gallium nitride epitaxial layer being grown between the electrodes. Using the Sentaurus TCAD software package, different numbers, widths, and depths of the GaN epitaxial layers were simulated. From our analysis, it was found that the output current of the photoconductor switch with the stacked structure was higher under the same conditions in the case of specific stack cells. In particular, the carriers’ transmission and distribution properties were changed. More specifically, a stacked structured PCSS with a width of 250μm, a depth of 1μm, and 10 stacked cells was also fabricated. A circuit with a50Ωload resistor was also used to test the performance of PCSS, and the switch was triggered by Nd:YAG 355-nm laser (18 ns full-width). From the extracted results, it was demonstrated that compared with the PCSS without the stack structure, the laser saturation energy required by the PCSS with the stack structure was reduced by 20%. When the laser energy was saturated, the on- resistance of the PCSS with stack structure was 37.3% less than that of the PCSS without stack structure when the applied bias voltage was 10 kV."
Integrated Four-Wavelength DFB Diode Laser Array for Continuous-Wave THz Generation,"[""Mengdie Sun"", ""Shaoyang Tan"", ""Fei Guo"", ""Songtao Liu"", ""Qiang Kan"", ""Dan Lu"", ""Ruikang Zhang"", ""Wu Zhao"", ""Song Liang"", ""Wei Wang"", ""Ronald Broeke"", ""Francisco. M. Soares"", ""Chen Ji""]",IEEE Photonics Journal,2016,18,0,https://ieeexplore.ieee.org/document/7491248/,"[""Key Laboratory of Semiconductor Materials Science, Beijing Key Laboratory of Low Dimensional Semiconductor Materials and Devices, Institute of Semiconductors, Chinese Academy of Sciences, Beijing, China"", ""Fraunhofer Heinrich Hertz Institute, Berlin, Germany"", ""Bright Photonics, Maarssen, The Netherlands""]","[""China"", ""Netherlands"", ""Germany""]","Impact Statement:The parallel design can produce better beating output compared with the serial design. A semiconductor optical amplifier is introduced to boost beating power and balance mode power through saturation effect. Tuning of THz beating frequency is realized through much faster current tuning. Widely tunable continuous-wave THz generation from 0.1 to 2.25 THz was demonstrated. The photonic integration chip is designed based on standard InP foundry model, which is capable of volume manufacturing.We demonstrate a four-wavelength distributed feedback (DFB) diode laser array integrated with a semiconductor optical amplifier (SOA) for widely tunable terahertz (THz) mode-beating generation. The InP-based monolithically integrated chip consists of DFB laser diodes, an SOA, and a multimode interference (MMI) coupler. Microheaters and electrode plates are integrated on top of each DFB section for continuous and independent wavelength tuning. By heterodyning the output from the DFB lasers on a Uni-Traveling Carrier Photodiode (UTC-PD) integrated antenna, a continuous THz radiation ranging from 0.1 to 2.25 THz was obtained."
Progress of Ultra-Wide Bandgap Ga2O3 Semiconductor Materials in Power MOSFETs,"[""Hongpeng Zhang"", ""Lei Yuan"", ""Xiaoyan Tang"", ""Jichao Hu"", ""Jianwu Sun"", ""Yimen Zhang"", ""Yuming Zhang"", ""Renxu Jia""]",IEEE Transactions on Power Electronics,2020,97,0,https://ieeexplore.ieee.org/document/8863396/,"[""Department of Physics, Chemistry, and Biology (IFM), Link\u00f6ping University, Link\u00f6ping, Sweden"", ""Key Laboratory of Wide Band Gap Semiconductor Materials and Devices, School of Microelectronics, Xidian University, Xi'an, China"", ""Department of Electronic Engineering, Xi'an University of Technology, Xi'an, China""]","[""Sweden"", ""China""]","As a promising ultra-wide bandgap semiconductor, the β-phase of Ga 2 O 3 has attracted more and more interest in the field of power electronics due to its ultra-wide bandgap (4.8 eV), high theoretical breakdown electric field (8 MV/cm), and large Baliga's figure of merit, which is deemed as a potential candidate for next generation high-power electronics, including diodes, field effect transistors (FETs), etc. In this article, we introduce the basic material properties of Ga 2 O 3 , and review the recent progress and advances of β-Ga 2 O 3 based metal-oxide-semiconductor field-effect transistors (MOSFETs). Due to the problematic p-type doping technology up to now, the enhancement-mode (E-mode) β-Ga 2 O 3 FETs face more difficulties, compared with depletion mode (D-mode). This article focuses on reviewing the recent progress of E-mode Ga 2 O 3 MOSFETs, summarizing and comparing various feasible solutions when p-type doping is absent. Furthermore, the device fabrication and performances of state-of-art β-Ga 2 O 3 MOSFETs, including D-mode, E-mode, and planar/vertical structure are fully discussed and compared, as well as potential solutions to the challenges of Ga 2 O 3 FETs."
Equilateral-Triangle and Square Resonator Semiconductor Microlasers,"[""Yue-De Yang"", ""Yong-Zhen Huang"", ""Kai-Jun Che"", ""Shi-Jiang Wang"", ""Yong-Hong Hu"", ""Yun Du""]",IEEE Journal of Selected Topics in Quantum Electronics,2009,22,0,https://ieeexplore.ieee.org/document/5068486/,"[""State Key Laboratory on Integrated Optoelectronics, Institute of Semiconductors, Chinese Academy and Sciences, Beijing, China""]","[""China""]","The characteristics of equilateral-triangle resonator (ETR) and square resonator microlasers are reported, which are potential light sources in the photonic integrations. Based on the numerical simulations, we find that high-efficiency directional emission can be achieved for the triangle and square microlasers by directly connecting an output waveguide to the resonators. The electrically injected InP/InGaAsP ETR and square resonator microlasers with a 2-mum-wide output waveguide were fabricated by standard photolithography and inductively coupled plasma etching techniques. Room-temperature continuous-wave (CW) operations were achieved for the ETR microlasers with the side length from 10 to 30 mum and the square resonator microlasers with the side length of 20 mum. The output power versus CW injection current and the laser spectra are presented for an ETR microlaser up to 310 K and a square resonator microlaser to 305 K. The lasing spectra with mode wavelength intervals as that of whispering-gallery-type modes and Fabry-Parot modes are observed for two square lasers, which can lase at low temperature and room temperature, respectively."
AlGaN/GaN power HFET on silicon substrate with source-via grounding (SVG) structure,"[""M. Hikita"", ""M. Yanagihara"", ""K. Nakazawa"", ""H. Ueno"", ""Y. Hirose"", ""T. Ueda"", ""Y. Uemoto"", ""T. Tanaka"", ""D. Ueda"", ""T. Egawa""]",IEEE Transactions on Electron Devices,2005,72,12,https://ieeexplore.ieee.org/document/1499081/,"[""Semiconductor Device Research Center, Matsushita Electric Industrial Company Limited, Semiconductor Company, Osaka, Japan"", ""Research Center for Nano-Device and Systems, Nagoya Institute of Technology, Nagoya, Japan""]","[""Japan""]","We have developed a high-power AlGaN/GaN HFET fabricated on 4-in conductive Si substrate with a source-via grounding (SVG) structure. The SVG structure enables efficient chip layout and high packing density by the vertical configuration. By establishing a high-quality epitaxial technology on a Si substrate and by significantly reducing the parasitic resistance, a very low specific on-state resistance of 1.9 m/spl Omega//spl middot/cm/sup 2/ is achieved. The breakdown voltage is as high as 350 V, which is attributed to the Si substrate acting as a backside field plate. Because of reduction of the parasitic inductance, very high level of current (2.0 kA/cm/sup 2/) transients, i.e., a turn-on time of 98 ps and a turn-off time of 96 ps, are successfully measured for the first time."
