Title,Author(s),Journal,Year,# times Cited (Papers),# times Cited (Patents),URL,Affiliations,Countries,Abstract
Fourier series expansion method for gain measurement from amplified spontaneous emission spectra of Fabry-Perot semiconductor lasers,"[""Wei-Hua Guo"", ""Qiao-Yin Lu"", ""Yong-Zhen Huang"", ""Li-Juan Yu""]",IEEE Journal of Quantum Electronics,2004,18,0,https://ieeexplore.ieee.org/document/1263679/,"[""Institute of Semiconductors, Chinese Academy and Sciences, Beijing, China""]","[""China""]","A gain measurement technique, based on Fourier series expansion of periodically extended single fringe of the amplified spontaneous emission spectrum, is proposed for Fabry-Perot semiconductor lasers. The underestimation of gain due to the limited resolution of the measurement system is corrected by a factor related to the system response function. The standard deviations of the gain-reflectivity product under low noise conditions are analyzed for the Fourier series expansion method and compared with those of the Hakki-Paoli method and Cassidy's method. The results show that the Fourier series expansion method is the least sensitive to noise among the three methods. The experiment results obtained by the three methods are also presented and compared."
Cavity controlled semiconductor lasers,"[""A. Mooradian""]",IEEE Journal of Selected Topics in Quantum Electronics,2000,0,0,https://ieeexplore.ieee.org/document/902185/,"[""Novalux, Inc., Sunnyvale, CA, USA""]","[""United States""]","This paper is describes some of the early history and more recent trends in the field of cavity-controlled semiconductor lasers. Topics covered include modal properties, spectral linewidth and surface-emitting lasers."
Automatic Defect Detection in Epitaxial Layers by Micro Photoluminescence Imaging,"[""Jacopo Frascaroli"", ""Marta Tonini"", ""Selene Colombo"", ""Luisito Livellara"", ""Luca Mariani"", ""Paolo Targa"", ""Roberto Fumagalli"", ""Viktor Samu"", ""M\u00e1t\u00e9 Nagy"", ""G\u00e1bor Moln\u00e1r"", ""\u00c1ron Horv\u00e1th"", ""Zolt\u00e1n Bartal"", ""Zolt\u00e1n Kiss"", ""Tam\u00e1s Sip\u0151cz"", ""Isabella Mica""]",IEEE Transactions on Semiconductor Manufacturing,2022,2,0,https://ieeexplore.ieee.org/document/9826355/,"[""Semilab Semiconductor Physics Laboratory Company Ltd., Budapest, Hungary"", ""STMicroelectronics, Agrate Brianza, Italy""]","[""Italy"", ""Hungary""]","The early in-line detection of defects is a fundamental step in semiconductor manufacturing to ensure the device quality. Inspection techniques currently available can effectively detect large epitaxial defects causing morphological surface variations like stacking faults, while dislocations go undetected. Herein we introduce a new technology with enhanced machine learning analysis, based on contactless and non-destructive room temperature micro-photoluminescence imaging (micro-PL), for the detection and classification of defects in silicon epitaxial layers. With laboratory microscopy techniques we investigate the correspondence between different defect morphologies in micro-PL images and extended crystallographic defects. A good matching in terms of defect density is found between automatic micro-PL analysis and the standard laboratory analysis in an interval spanning from few defects/cm 2 up to 10 5 defects/cm 2 ."
Modeling of Variation in Submicrometer CMOS ULSI Technologies,"[""S.K. Springer"", ""S. Lee"", ""N. Lu"", ""E.J. Nowak"", ""J.-O. Plouchart"", ""J.S. Watts"", ""R.Q. Williams"", ""N. Zamdmer""]",IEEE Transactions on Electron Devices,2006,57,3,https://ieeexplore.ieee.org/document/1677850/,"[""Systems and Technology Group, IBM Semiconductor Research and Development Center, Essex Junction, VT, USA"", ""Systems and Technology Group, IBM Semiconductor Research and Development Center, Hopewell Junction, NY, USA""]","[""United States""]","The scaling of semiconductor technologies from 90- to 45-nm nodes highlights the need for accurate and predictive compact models that address the regime where small-scale physical effects become dominant. These demanding requirements on compact models extend beyond the core model to a suite of design tools that include extraction tools and statistical methods to account for unpredictable variation (e.g., random dopant fluctuations and polysilicon linewidth variation) and predictable variation (e.g., transistor response differences that are layout dependent). Layout-dependent or local environment differences are driven by factors such as lithography and novel performance-enhancing process techniques such as dual-stress nitride liner films. Sources of variation such as rapid thermal annealing temperature, low-frequency noise, and modeling of back-end-of-line elements need to be considered. The modeling of intradie and interdie variations, updated for small geometries, should be properly positioned in the design flow. This paper presents the challenges and results of compact modeling at the 65-nm node and beyond."
Characterizing the Economic Value of Organizational Learning in Semiconductor Manufacturing,"[""Charles M. Weber""]",IEEE Transactions on Semiconductor Manufacturing,2013,11,0,https://ieeexplore.ieee.org/document/6266756/,"[""Department of Engineering and Technology Management, Portland State University, Portland, OR, USA""]","[""United States""]","This paper describes an empirical study that assesses the economic value of various forms of organizational learning that are common in semiconductor manufacturing. This study considers three business environments: very large-scale integrated circuits, commodity components, and specialty parts with high value added. This study finds that the economic value of organizational learning varies over time, the relative economic value of different learning practices varies over time, the external economic environment strongly influences the economic value of different learning practices, the economic value of learning can be positive or negative, and the synergy between different kinds of learning can be positive or negative. The primary contribution of this paper is an empirically grounded model of organizational learning in the semiconductor manufacturing industry, which potentially enhances the profitability of semiconductor manufacturing ventures. The model helps practicing managers make investment decisions through scenario planning and identifies learning strategies that are tailored to their particular economic environment. This paper also provides insight into the structure of technological knowledge in semiconductor manufacturing, which has historically been treated as a black box."
1.6-kV 1.5-kA GaAs Avalanche Semiconductor Switch Triggered by 4 μJ Laser Diode,"[""Cheng Ma"", ""Nuo Xu"", ""Zenan Liu"", ""Yuezheng Wang"", ""Wei Shi""]",IEEE Journal of the Electron Devices Society,2020,0,0,https://ieeexplore.ieee.org/document/9001089/,"[""Key Laboratory of Ultrafast Photoelectric Technology and Terahertz Science in Shaanxi, Xi\u2019an University of Technology, Xi\u2019an, China""]","[""China""]","A current of 1.54 kA was obtained under a bias voltage of only 1.6 kV by employing a single photoconductive semiconductor switch (PCSS) excited by a laser diode (LD) with energy of 4 μJ. In this work, an opposed contact structure PCSS was used instead of a lateral structure one. We show that a avalanche multiplication rate of PCSS as high as 258 has been obtained. The effects of the electric field strength and of the capacitance on the current waveform were investigated. Moreover, the damping degree was calculated in combination with the current waveform. The calculation indicates that the current attenuation degree increases upon the increase of the capacitance for a fixed value of the electric field strength, whereas the current attenuation degree decreases upon the increase of electric field strength for a fixed charging capacitance. The results obtained in this work show that, by employing opposed contact structure PCSSs in combination with a relatively low bias voltage and laser pulse energy, high-current and long pulse power devices based on inexpensive and compact sources can be produced."
Dynamic P-I and P-V Curves for Semiconductor Lasers and Modulators,"[""Ning Hua Zhu"", ""Qi Qi Ge Hasen"", ""Hong Guang Zhang"", ""Ji Min Wen"", ""Liang Xie""]",Journal of Lightwave Technology,2008,2,0,https://ieeexplore.ieee.org/document/4738537/,"[""State Key Laboratory on Integrated Optoelectronics, Institute of Semiconductor Chinese Academy of Sciences, Beijing, China""]","[""China""]","In this paper, we propose the dynamic P-V curve for modulator and P-I curve for laser diode, and present a simple approach to deriving the curves from the small-signal frequency responses measured using a microwave network analyzer. The linear response range, modulation efficiency, optimal driving conditions at different frequency can, therefore, be determined. It is demonstrated that the large-signal performance of electro-absorption (EA) modulator and the directly modulated semiconductor lasers can be predicted from the dynamic curved surface. Experiments show a good agreement between the evaluated characteristics and the measured large-signal performance."
Influences of Ridge-Waveguide Shape and Width on Performances of InP-Based Coupled Ridge-Waveguide Laser Arrays,"[""Zhong-Kai Zhang"", ""Feng Xu"", ""Jin-Chuan Zhang"", ""Zun-Ren Lv"", ""Xiao-Guang Yang"", ""Tao Yang""]",IEEE Journal of Quantum Electronics,2018,0,0,https://ieeexplore.ieee.org/document/8421229/,"[""Key Laboratory of Semiconductor Materials Science, Institute of Semiconductors, Chinese Academy of Sciences, Beijing, China"", ""College of Materials Sciences and Opto-Electronic Technology, University of Chinese Academy of Sciences, Beijing, China""]","[""China""]","Impact Statement:Lasers emitting in 2μm band with both high output power and high beam quality are of significant value for practical applications such as free space communication, gas detection, biomedicine, military fields, and so on. Compared with the master-oscillator power-amplifiers and angled cavity lasers, which show excellent performances but with complicated structures, the coupled ridge waveguide laser arrays have compact structure and simple fabrication processes. And these advantages effectively increase the repeatability and reduce the cost of the devices, making it have huge potential and broad prospects in practical applications. So far, extensive researches have been in progress, but there is seldom report in regard to the band of 2μm yet, and here we introduce the structure to our InP-based lasers emitting at 2.1μm.We investigate the influences of ridge-waveguide shape and width on performances of InP-based coupled ridge waveguide laser arrays emitting at2.1 μm. Four devices with different shapes and widths of ridge elements are fabricated. The trapezoid ridges reduce the optical losses at regions between ridge elements in the trapezoid devices, thus enhances the optical coupling between ridge elements and lead to larger coherent output powers compared with the rectangular ones. Meanwhile, narrower ridges with the same shape give a stronger optical confinement to the lateral modes in every single ridge and improve the overall modal and far-field characteristics of the device. The results show that the trapezoid and narrower ridges can lead to a comprehensive improvement in the performances of the coupled ridge waveguide laser arrays emitting at2.1 μm."
Coupled Electromagnetic and Hydrodynamic Semiconductor Modeling for Terahertz Generation,"[""Arif Can Gungor"", ""Michael Doderer"", ""Hande Ibili"", ""Jasmin Smajic"", ""Juerg Leuthold""]",IEEE Transactions on Magnetics,2022,0,0,https://ieeexplore.ieee.org/document/9756451/,"[""Institute of Electromagnetic Fields (IEF), ETH Z\u00fcrich, Z\u00fcrich, Switzerland""]","[""Switzerland""]","Terahertz (THz) electrical signal generation from a photoactive semiconductor device illuminated by an optical pulse is modeled and simulated. Hydrodynamic equations in time domain are numerically solved for both electrons and holes using the discontinuous Galerkin time-domain finite element method (DGTD-FEM) for the high-frequency charge transport that occurs in the semiconductor device. The obtained frequency spectra of photocurrent in various semiconductor materials under illumination of an ultrashort light pulse are presented. The inertia effects and ballistic transport of carriers play an important role to determine the frequency response of these materials, and the developed hydrodynamic model (HDM) solver delivers a transport analysis by predicting higher and wideband frequency capabilities for GaAs and Ge detectors over Si-photodetectors."
Reduced PFC emissions and gas consumption using a c-C/sub 4/F/sub 8/-based PECVD chamber clean chemistry,"[""K. Avala"", ""Li Liu"", ""D. Brindza"", ""G. Loh"", ""S.A. Moiyadi""]",IEEE Transactions on Semiconductor Manufacturing,2004,0,0,https://ieeexplore.ieee.org/document/1353303/,"[""TriQuint Semiconductor, Inc., Hillsboro, OR, USA"", ""DuPont Electronic Gases, DuPont Fluoroproducts, Wilmington, DE, USA""]","[""United States""]","Perfluorocompounds (PFCs) used in semiconductor manufacturing are potential contributors to greenhouse gas-driven climate change. PFCs emitted from plasma enhanced chemical vapor deposition (PECVD) chamber cleans can be a significant portion of the total PFC emissions for a typical semiconductor fabrication facility. Previous work adopting octafluorocyclobutane (c-C/sub 4/F/sub 8/) clean chemistries to reduce gas consumption and PFC emissions have been reported on applied materials and novellus PECVD tools. In this study, c-C/sub 4/F/sub 8/ was evaluated as an alternative chamber clean gas on Mattson ASPEN II PECVD tools. A statistical design of experiment (DOE) methodology and tool emission analysis by Fourier transform infrared spectrometry were used to develop a low gas consumption and low PFC emission process. This c-C/sub 4/F/sub 8/ process reduced the clean gas consumption by 65% and PFC emission by 78%, compared to our current C/sub 2/F/sub 6/ clean with no impact on deposited film properties or process repeatability."
Study of Nonthermal-Equilibrium Carrier Recombination and Transport in β–Ga2O3Metal–Semiconductor–Metal Deep-Ultraviolet Photodetectors,"[""Maolin Zhang"", ""Wanyu Ma"", ""Shan Li"", ""Lili Yang"", ""Zeng Liu"", ""Yufeng Guo"", ""Weihua Tang""]",IEEE Transactions on Electron Devices,2023,5,0,https://ieeexplore.ieee.org/document/10068335/,"[""College of Integrated Circuit Science and Engineering, Innovation Center for Gallium Oxide Semiconductor (IC-GAO), National and Local Joint Engineering Laboratory for RF Integration and Micro-Assembly Technologies, Nanjing University of Posts and Telecommunications, Nanjing, China""]","[""China""]","Ultrawide bandgap semiconductor gallium oxide (Ga2O3) demonstrates a considerable advantage in detecting deep-ultraviolet (DUV) light signals in extreme environments. Relevant studies have shown that the Ga2O3 DUV photodetector (PD) is a promising candidate for high-temperature applications; however, its temperature-influenced photodetection performance has yet to be investigated. In this work, a Ga2O3 metal–semiconductor–metal (MSM) DUV PD was fabricated, and its temperature-dependent photodetection performance was studied. Decent detection metrics, including a photo-to-dark current ratio (PDCR) of1.1×106, a responsivity (R) of 45.83 mA/W, a specific detectivity (D∗) of3.4×1013Jones, and an external quantum efficiency (EQE) of 22.4%, were achieved but decreased with increasing temperature. The increased operation temperature led to an increase in the dark current and a decrease in the photocurrent. In addition, the impact of high temperature on the photocurrent gain mechanism was examined in detail based on carrier recombination and transport processes. In general, impressive robustness of the Ga2O3 MSM DUV PD was achieved, further stressing the detection capability of Ga2O3 DUV PDs in harsh environments."
Frequency-Tunable Broadband Microwave Comb Generation Using an Integrated Mutually Coupled DFB Laser,"[""Wu Zhao"", ""Yuanfeng Mao"", ""Yaobin Li"", ""Guangcan Chen"", ""Dan Lu"", ""Qiang Kan"", ""Lingjuan Zhao""]",IEEE Photonics Technology Letters,2020,3,0,https://ieeexplore.ieee.org/document/9208646/,"[""Key Laboratory of Semiconductor Materials Science, Institute of Semiconductors, Chinese Academy of Sciences, Beijing, China""]","[""China""]","A microwave frequency comb (MFC) generator based on an integrated mutually coupled (IMC) distributed feedback (DFB) laser is demonstrated. The proposed MFC generator is simple and compact, only consisting of an IMC laser, a microwave signal generator, and a photodetector. By adjusting the bias currents of the three sections of the IMC laser and the modulation parameters, the bandwidth of the MFC can be significantly enhanced compared to the case adopting a solitary DFB laser. The characteristics of the MFC with the tuning current and the modulation parameters were investigated experimentally to determine the optimum operating condition. A broadband MFC with 40 GHz bandwidth within a ±5 dB amplitude variation was achieved under a modulation frequency of 2 GHz."
Theoretical Prediction of High-Performance Room-Temperature InGaAs/Si Single-Photon Avalanche Diode Fabricated by Semiconductor Interlayer Bonding,"[""Shaoying Ke"", ""Zhixiang Chen"", ""Jinrong Zhou"", ""Jinlong Jiao"", ""Xiaoqiang Chen"", ""Songyan Chen""]",IEEE Transactions on Electron Devices,2021,0,0,https://ieeexplore.ieee.org/document/9360497/,"[""College of Physics and Information Engineering, Minnan Normal University, Zhangzhou, China"", ""Department of Physics, Fujian Provincial Key Laboratory of Semiconductors and Applications, Collaborative Innovation Center for Optoelectronic Semiconductors and Efficient Devices, Xiamen University, Xiamen, China""]","[""China""]","Single-photon avalanche diode (SPAD) is an ultrasensitive device for the detection of weak signals. Epitaxial InP-based devices exhibit poor avalanche characteristics and poor compatibility with Si complementary metal oxide semiconductor (CMOS) circuit, and epitaxial Si-based devices show high dark count rate (DCR) and limited detection wavelength. Here we first show a new generation of InGaAs-on-Si SPADs, achieved by semiconductor interlayer bonding, for the detection of 1550-nm infrared signals theoretically. This wafer-bonded InGaAs/Si SPAD has enabled a significant step-change in performance. The dark current of this SPAD is four orders of magnitude lower than that of the epitaxial ones (300 K). High gain-bandwidth-product of 254 and 353 GHz is achieved at the gain of ~ 24 and ~ 36, respectively, for the wafer-bonded SPAD with polycrystalline Si bonding layer at InGaAs/Si bonded interface. In comparison with epitaxial SPADs, the wafer-bonded ones exhibit low DCR ( ~ 10 5 Hz at 10% V br ), high single photon detection efficiency ( ~ 24% at 10% V br ), and high pulse repetition rate (1 GHz at 5% V br ) at 300 K. These results indicate that utilizing the wafer-bonded platform, the route toward high-performance InGaAs-on-Si SPAD arrays for use in future eye-safe laser radar (LIDAR) and quantum communication at room temperature (RT) is expected to be achieved."
Picosecond-Range Avalanche Switching of Bulk Semiconductors Triggered by Steep High-Voltage Pulses,"[""Viktor I. Brylevskiy"", ""Irina A. Smirnova"", ""Natalia I. Podolska"", ""Yulia A. Zharova"", ""Pavel B. Rodin"", ""Igor V. Grekhov""]",IEEE Transactions on Plasma Science,2019,4,0,https://ieeexplore.ieee.org/document/8506403/,"[""Ioffe Institute, Saint Petersburg, Russia""]","[""Russia""]","Experimental observation and numerical simulations of sub-nanosecond avalanche switching of Si and ZnSe bulk semiconductor structures initiated by high-voltage pulses with steep (dU / dt > 10 kV/ns) ramp are reported. The measured switching time is ~100ps. The switching is sustainable and repetitive and has negligible jitter. Comparison of the experimental and numerical results suggests that after switching, the whole volume of the structure is uniformly filled with nonequilibrium electron-hole plasma."
Low-Voltage AlGaAs/GaAs Thyristors as High-Peak-Current Pulse Switches for High-Power Semiconductor Laser Pumping,"[""Sergey O. Slipchenko"", ""Aleksandr A. Podoskin"", ""Vyacheslav S. Golovin"", ""Polina S. Gavrina"", ""Victor V. Shamakhov"", ""Dmitriy N. Nikolaev"", ""Vasilii V. Zolotarev"", ""Nikita A. Pikhtin"", ""Timur A. Bagaev"", ""Maxim A. Ladugin"", ""Aleksandr A. Marmalyuk"", ""Vladimir A. Simakov""]",IEEE Transactions on Electron Devices,2020,9,0,https://ieeexplore.ieee.org/document/8908823/,"[""Ioffe Institute, Saint Petersburg, Russia"", ""Stel\u2019makh Research and Development Institute \u201cPolyus,\u201d, Moscow, Russia""]","[""Russia""]","The dynamic characteristics of a low-voltage thyristor based on an AlGaAs/GaAs heterostructure have been studied in the mode of generation of high-amplitude pulses with width of tens of nanoseconds in a circuit with low-impedance load based on an array of high-power AlGaAs/GaAs semiconductor lasers. The presented approach uses thyristors and diode laser arrays as discrete components, so it can be extended to other (not AlGaAs/GaAs-based) semiconductor lasers. It is demonstrated that a current pulse can be generated with an amplitude of 69 A and a width of 40 ns in a vertically assembled stack of an array of semiconductor lasers and thyristors. It was shown that raising the number of single thyristors does not lead to pulse broadening and makes it possible to raise several-fold the peak current amplitude to 208 A, with the peak laser emission power reaching a value of 78 W."
Theory of large-signal direct modulation of extended cavity semiconductor lasers with dispersive loss,"[""L. Ramunno"", ""J.E. Sipe""]",IEEE Journal of Quantum Electronics,2000,0,0,https://ieeexplore.ieee.org/document/890281/,"[""Department of Physics, University of Toronto, Toronto, ON, Canada""]","[""Canada""]","We present a model of coupled semiconductor diode-dispersive extended cavity lasers that describes arbitrarily large current modulation, does not assume uniform photon and carrier densities within the semiconductor diode gain medium, and is simple to implement numerically. In particular, we look at the fiber grating laser, an example of such a coupled system that has been studied as a possible optical communications source. We find simple expressions for the instantaneous frequency and intensity in terms of a few parameters characterizing the dispersion, allowing for the design of the system to minimize chirp. From these expressions we also recover Kazarinov and Henry's adiabatic chirp formula in the limit of slow modulation and Petermann's dynamical chirp formula in the limit of uniform carrier and photon densities. We show that in typical cases, where nonuniformity is important, the instantaneous frequency modulation is quantitatively and qualitatively different than is predicted by previous models."
Simultaneous generation of eight wavelengths with about 20-nm spacing from a single semiconductor laser,"[""Chi-Chia Huang"", ""Yi-Shin Su"", ""Ching-Fuh Lin""]",IEEE Photonics Technology Letters,2005,1,0,https://ieeexplore.ieee.org/document/1396052/,"[""Graduate Institute of Electro-Optical Engineering and the Department of Electrical Engineering, National Taiwan University, Taipei, Taiwan"", ""Institute of Electronics Engineering, National Taiwan University, Taipei, Taiwan""]","[""Taiwan""]","Simultaneous generation of eight wavelengths spanning from 1367.1 to 1526.9 nm with about 20-nm channel spacing is achieved using a single semiconductor laser. The full-width at half-maximum of each mode is smaller than 0.3 nm. The sidemode suppression ratio is larger than 28 dB and the ratio of the signal to the background noise is larger than 30 dB. With careful adjustment of the loss for each mode, the power difference among those modes can be less than 3 dB. The performance of the eight-wavelength laser system can be further improved with the reduced loss of the external cavity."
Intensity Noise Distribution of Semiconductor Lasers Measured Using Bit-Error-Rate Testers,"[""K.-L. Chen"", ""C. Wang"", ""J. Wilks""]",IEEE Photonics Technology Letters,2006,1,0,https://ieeexplore.ieee.org/document/1703635/,"[""Emcore Corporation, Santa Clara, CA, USA"", ""Avago Technologies, Inc., San Jose, CA, USA""]","[""United States""]","Laser noise has been well studied both theoretically and experimentally. Most of the previous experimental work examined the standard deviation of the noise, with the implicit assumption of a Gaussian noise distribution. We employ a new approach to measure the semiconductor laser noise distribution down to a bit-error ratio (BER) of10−11. This method takes advantage of the high sampling rate of modern BER testers. We found that the noise distribution for a 1310-nm Fabry–PÉrot laser and a 1550-nm distributed-feedback laser are well fitted by Gaussian distributions."
