Title,Author(s),Journal,Year,# times Cited (Papers),# times Cited (Patents),URL,Affiliations,Countries,Abstract
SNR improvement of DPSK signals in a semiconductor optical regenerative amplifier,"[""M. Shin"", ""P.S. Devgan"", ""V.S. Grigoryan"", ""P. Kumar""]",IEEE Photonics Technology Letters,2006,9,2,https://ieeexplore.ieee.org/document/1546033/,"[""Center for Photonic Communication and Computing, Electrical and Computer Engineering Department, Northwestern University, Evanston, IL, USA""]","[""United States""]",Signal-to-noise ratio improvement using a semiconductor optical regenerative amplifier (SORA) is characterized. It is demonstrated that for a noise-degraded return-to-zero differential phase-shift keying signal at 10 Gb/s the Q factor at the SORA's output is improved relative to its input for both the phase and amplitude noise cases. The Q-factor improvement is 1.6 dB in single-channel operation for the phase-noise only case and 0.55 dB for the amplified spontaneous emission noise-only case through the SORA.
110-pJ and 410-fs pulse at 10 GHz generated by single-stage external fiber compression of optically injection-mode-locked semiconductor optical amplifier fiber laser,"[""Gong-Ru Lin"", ""I-Hsiang Chiu""]",IEEE Photonics Technology Letters,2006,8,0,https://ieeexplore.ieee.org/document/1621260/,"[""Department of Photonics and Institute of Electro-Optical Engineering, National Chiao Tung University, Hsinchu, Taiwan""]","[""Taiwan""]","We demonstrate the high-power amplification and single-stage fiber-based pulse compression of a traveling-wave semiconductor optical amplifier (TWSOA) fiber ring laser (SOAFL), which is optically mode-locked by backward injecting the TWSOA with a dark-optical-comb at repetition frequency of 10 GHz. A negatively chirped SOAFL pulsewidth of 5.4 ps is compensated and shortened to 3.9 ps by a 75-m-long dispersion compensating fiber. With a single-stage pulse compression in a single-mode-fiber spool, the SOAFL pulses with input average power of 1.7 W can further be compressed to a pulsewidth of 410 fs, corresponding to a pulse compressing ratio of nearly ten. The maximum average output power of the amplified SOAFL pulse is up to 1.1 W, corresponding to the peak power and pulse energy of >0.27 kW and 110 pJ, respectively."
All-optical Lyot-filter-assisted flip-flop operation using a semiconductor optical amplifier,"[""P.D. Kumavor"", ""E. Donkor"", ""B.C. Wang""]",IEEE Journal of Selected Topics in Quantum Electronics,2006,6,0,https://ieeexplore.ieee.org/document/1668112/,"[""Electrical and Computer Engineering Department, University of Connecticut, Storrs, CT, USA""]","[""United States""]","All-optical flip-flop operation using external optical control is demonstrated in a single semiconductor optical amplifier (SOA)-based fiber ring laser with an intracavity Lyot filter. Its operation is based on the principle of cross-gain saturation in the SOA. A unique feature of this flip-flop is its ability to be set and reset at multiple wavelength pairs of an auxiliary continuous wave control light that is injected into the fiber ring cavity; this, together with the wide wavelength tunability of the Lyot filter makes the flip-flop potentially useful in wavelength-division multiplexing applications. Bistable output at 1571 nm with a contrast ratio of 20 dB between the two output power states of the flip-flop using -3 dBm power of the external optical control is demonstrated"
A Tunable Multiwavelength Laser Employing a Semiconductor Optical Amplifier and an Opto-VLSI Processor,"[""Muhsen Aljada"", ""Kamal Alameh"", ""Yong Tak Lee""]",IEEE Photonics Technology Letters,2008,5,2,https://ieeexplore.ieee.org/document/4492812/,"[""Department of Information and Communications, Gwangju Institute of Science and Technology, Gwangju, South Korea"", ""Centre of Excellence for MicroPhotonic System, Edith Cowan University, Joondalup, WA, Australia""]","[""Australia"", ""South Korea""]","We propose and experimentally demonstrate a stable tunable multiwavelength laser employing a semiconductor optical amplifier (SOA) in conjunction with an opto-very-large-scale-integration (VLSI) processor. By uploading digital phase holograms onto the opto-VLSI processor, the amplified spontaneous emission of the SOA is arbitrarily sliced and injected back into the SOA to generate multiple lasing wavelengths with a linewidth of 0.5 nm. Experimental results demonstrate a tunable multiwavelength laser with a tuning range from 1528 to 1533 nm with power fluctuations of less than 0.5 dB."
Competition of Rational Harmonic Mode-Locking and Continuous-Wave Lasing in Semiconductor Optical Amplifier Fiber Laser Under Optical Pulse Injection,"[""Chao-Kuei Lee"", ""Jung-Jui Kang"", ""Gong-Ru Lin""]",Journal of Lightwave Technology,2009,4,0,https://ieeexplore.ieee.org/document/4814827/,"[""Graduate Institute of Photonics and Optoelectronics, and the Department of Electrical Engineering, National Taiwan University, Taipei, Taiwan"", ""Department of Photonics, National Sun Yat-Sen University, Kaohsiung, Taiwan""]","[""Taiwan""]","Twentieth-order rational harmonic mode-locking (RHML) semiconductor optical amplifier fiber laser (SOAFL) pulses are demonstrated by using 1-GHz backward dark-optical comb injection. Maximum frequency detuning range of plusmn 300 Hz, broadened pulsewidth of 35 ps, and highest average power of 0.4 muW for twentieth-order RHML-SOAFL pulse are characterized. The extraordinary phenomena on the red-shifted wavelength from 1535.5 to 1541.5 nm and the corresponding spectral linewidth reduced from 12 to 3 nm are observed with the RHML order increasing to 8 or higher. Such a less pronounced RHML mechanism at higher orders occurred in the optically injection mode-locked SOAFL is mainly attributed to the weak mode-locking strength at high RHML orders as compared to continuous-wave lasing mechanism."
Measurement of Gain Spectra of Semiconductor Lasers Using Least Squares Fitting Method,"[""Minming Zhang"", ""Deming Liu"", ""Toshihiko Makino""]",IEEE Photonics Technology Letters,2013,3,0,https://ieeexplore.ieee.org/document/6512028/,"[""National Engineering Laboratory for Next Generation Internet Access Systems, School of Optical and Electronic Information, and Wuhan National Laboratory for Optoelectronics, Huazhong University of Science and Technology, Wuhan, China"", ""Inphenix, Inc., Livermore, CA, USA""]","[""China"", ""United States""]","A new technique for the measurement of net modal gain spectra of semiconductor lasers is presented. The technique is based on a least squares curve fitting to each longitudinal mode of amplified spontaneous emission spectrum. The errors of measurement over a wide wavelength range because of the asymmetric shape of individual mode and the limit resolution of the optical spectrum analyzer are greatly reduced, compared with those of conventional methods."
"All-Optical Low-Power 2 $\,\times\,$2 Cross/Bar Switch With a Single Semiconductor Optical Amplifier","[""C. Porzi"", ""L. Ma"", ""M. Yao"", ""L. Pot\u00ed"", ""A. Bogoni""]",IEEE Photonics Technology Letters,2010,2,0,https://ieeexplore.ieee.org/document/5497079/,"[""CNIT, Pisa, Italy"", ""Department of Electronic Engineering, Tsinghua University, Beijing, China"", ""Scuola Superiore Sant'' Anna, Pisa, Italy""]","[""Italy"", ""China""]",An all-optical 2 × 2 cross/bar switch is demonstrated exploiting nonlinear polarization rotation in a single semiconductor optical amplifier. The proposed architecture allows operation with packets at the same input wavelengths and does not require high-speed clock control pump signals. Bit-error-rate measurements at the switch output ports for both cross/bar configurations and for both cases of one and two packet signals connected to the input ports are performed. A maximum of 2.3 dB of power penalty was observed in the worst case. The switching energy was as low as about 400 fJ per bit at 10 Gb/s.
Multicanonical Evaluation of the Tails of the Probability Density Function of Semiconductor Optical Amplifier Output Power Fluctuations,"[""Bjarne Tromborg"", ""Michael Reimer"", ""David Yevick""]",IEEE Journal of Quantum Electronics,2010,2,0,https://ieeexplore.ieee.org/document/5350977/,"[""Department of Physics and Astronomy, University of Waterloo, Waterloo, ONT, Canada"", ""Department of Photonics Engineering, DTU Fotonik, Technical University of Denmark, Lyngby, Denmark""]","[""Denmark"", ""Canada""]",This paper presents a multicanonical Monte Carlo method for simulating the tails of a probability density function (pdf) of the filtered output power from a semiconductor optical amplifier down to values of the order of 10 -40 . The influence of memory effects on the pdf is examined in order to demonstrate the manner in which the calculated pdf approaches the true pdf with increasing integration time. The simulated pdf is shown to be in good agreement with a second-order analytic expression for the pdf.
Theoretical Analysis of a New Technique for Inertial Rotation Sensing Using a Semiconductor Ring Laser,"[""Antonio Perez-Serrano"", ""Alessandro Scire""]",IEEE Photonics Technology Letters,2009,1,0,https://ieeexplore.ieee.org/document/4813272/,"[""CSIC-UIP, Instituto de F\u00edsica Interdisciplinary Sistemas Complejos, Palma de Mallorca, Spain""]","[""Spain""]","We introduce a new technique for the measurement of inertial rotations using a semiconductor ring laser. Inertial rotation introduces a frequency deviation of the optical frequency of the two counterpropagating waves in the laser cavity, whereas mode coupling causes frequency attraction (frequency pushing) and finally locking at low rotation rates, washing out the small Sagnac frequency difference to be measured. Here we propose to measure inertial rotation whitin the so-called locking band using the phase/amplitude dependence on detuning found for the oscillating modes under the gain line. The dephasing accumulated by the two counterpropagating waves unbalances the fields' amplitudes within the locking region. We analytically derive the responsivity function quantifying the two-mode power unbalance versus rotation rate, by means of a two-mode rate equations model. Noise performance of a possible rotations sensor are also discussed by calculating the noise equivalent rotation rate."
Rigorous numerical analysis of mode beating in tapered semiconductor amplifiers,"[""B.M.A. Rahman"", ""R. Abdallah"", ""M. Rajarajan"", ""S.S.A. Obayya"", ""K.T.V. Grattan""]",Journal of Lightwave Technology,2005,0,0,https://ieeexplore.ieee.org/document/1440521/,"[""School of Engineering and Mathematical Sciences, City University, London, UK"", ""Brunei University, Uxbridge, UK""]","[""UK""]","The evolution of the optical beam profile along a high-power tapered semiconductor amplifier has been demonstrated by using rigorous and full-vectorial numerical approaches, based on the finite-element method. Numerically simulated results indicate the generation of many higher order modes, and their interference with the fundamental mode causes a variation of the optical beam, both along the transverse and the axial directions, which could significantly modify the output beam quality."
Reduction of the Longitudinal Multi-Modes Dynamics of a Driven Semiconductor Amplifier to a Single Scalar Partial Differential Equation,"[""Lorenzo Columbo"", ""Lionel Gil""]",IEEE Journal of Quantum Electronics,2009,0,0,https://ieeexplore.ieee.org/document/5210219/,"[""Institut du Non Lin\u00e9aire de Nice U.M.R.C.N.R.S. 6618, Universit\u00e9 de Nice, La Valbonne, France""]","[""France""]","In the plane wave approximation, we analytically study spatio-temporal dynamics of a semiconductor amplifier driven by a coherent injected field in a Fabry-Perot configuration. We manage to reduce the dynamics to a single evolution equation for the slow variable represented by the carrier density, to analytically compute the stationary field configurations and to predict their stability. The numerical simulations, performed by implementing an efficient and accurate split-step code, perfectly agree with the analytical results."
Low-Resistance Ta/Al/Ni/Au Ohmic Contact and Formation Mechanism on AlN/GaN HEMT,"[""Hao Lu"", ""Bin Hou"", ""Ling Yang"", ""Fang Song"", ""Meng Zhang"", ""Mei Wu"", ""Xiaohua Ma"", ""Yue Hao""]",IEEE Transactions on Electron Devices,2022,3,0,https://ieeexplore.ieee.org/document/9915463/,"[""State Key Discipline Laboratory of Wide Band-Gap Semiconductor Technology, School of Microelectronics, Xidian University, Xi\u2019an, China"", ""Instrumental Analysis Center, Xi\u2019an University of Architecture and Technology, Xi\u2019an, China""]","[""China""]","In this article, we systematically investigated the Ta/Al/Ni/Au and Ti/Al/Ni/Au ohmic contacts, and contact formation mechanism on ultrawide bandgap (UWBG) AlN barrier heterostructure without using the source–drain regrowth technique. The excellent ohmic contact performance of the Ta-based scheme was observed. The transmission line model (TLM) results depicted an ultralow contact resistance of0.08Ω⋅mm and a specific contact resistance of1.06×10−7Ω⋅cm2. Atomic force microscope (AFM) shows that the Ta/Al/Ni/Au sample presents a surface morphology improvement compared with the Ti/Al/Ni/Au sample. Transmission electron microscope (TEM) illustrated that the dominant contact mechanism for ultralow resistance is direct contact through TaxAlyAuz alloy penetration. Meanwhile, the difficulty of contact formation for the Ti-based sample was also discussed through the microstructural analysis. These results demonstrate that the proposed Ta/Al/Ni/Au metal scheme is a high-performance and cost-effective ohmic contact technique well suited for AlN/GaN HEMT fabrication process."
"Study on 20 V LDMOS With Stepped-Gate-Oxide Structure for PMIC Applications: Design, Fabrication, and Characterization","[""Sue-Yi Chen"", ""Benjamin Liao"", ""Jia-Ching Dong"", ""Tim Wang"", ""Shu-Len Wang"", ""Hsiao-Ying Yang"", ""Yin-Wei Peng"", ""Shao-Chang Huang"", ""Jon-Yiew Gan""]",IEEE Transactions on Electron Devices,2022,0,0,https://ieeexplore.ieee.org/document/9648223/,"[""Department of Materials Science and Engineering, National Tsing Hua University, Hsinchu, Taiwan"", ""Vanguard International Semiconductor Corporation, Hsinchu, Taiwan""]","[""Taiwan""]","In this brief, a 20 V laterally diffused metal-oxide-semiconductor (LDMOS) device with the concept of stepped-gate-oxide (SGO) was fabricated with standard0.15 μmBCD technology. Compared with the conventional shallow-trench-isolation LDMOS (STI-LDMOS), the SGO structure features a straight conduction path on a silicon surface, based on our past development experience, and therefore, an ON-resistance reduction of about 20% can be obtained. This brief demonstrated the LDMOS from a power-switching perspective, considering both optimization design and characterization aspects. The optimum device was demonstrated withRON,spof 4.92mΩ⋅mm 2 , breakdown voltage (BV) of 23.8 V, and device figure of merit (FOM) of 20mΩ-nC. By combining with optimum power stage design, the buck converter efficiency showed 93.88% at low load condition and 93.98% at high load condition, achieving an outstanding dc–dc converting performance."
An MMI-Based Mode (DE)MUX by Varying the Waveguide Thickness of the Phase Shifter,"[""Fei Guo"", ""Dan Lu"", ""Ruikang Zhang"", ""Huitao Wang"", ""Songtao Liu"", ""Mengdie Sun"", ""Qiang Kan"", ""Chen Ji""]",IEEE Photonics Technology Letters,2016,14,0,https://ieeexplore.ieee.org/document/7542571/,"[""Chinese Academy of Sciences, Key Laboratory of Semiconductor Material Sciences and the Beijing Key Laboratory of Low Dimensional Semiconductor Materials and Devices Institute of Semiconductors, Beijing, China""]","[""China""]","A two-mode (de)multiplexer [(DE)MUX] based on multimode interference couplers on InP substrate is proposed and experimentally demonstrated. A phase shifting section with a variation of the waveguide thickness is introduced to precisely control the phase shift to realize 100% mode conversion efficiency and multiplexing. Performance analysis of the (DE)MUX is carried out numerically, showing excellent properties with insertion loss <;1.2 dB and crosstalk <;-18.4 dB for both the TE 0 and TE 1 mode within the whole C-band. The proposed device is also fabricated and demonstrated on InP substrate."
Evanescently Coupled Waveguide InGaAs UTC-PD Having an Over 21 GHz Bandwidth Under Zero Bias,"[""Siwei Sun"", ""Song Liang"", ""Junjie Xu"", ""Limeng Zhang"", ""Lu Guo"", ""Xiao Xie"", ""Hongliang Zhu"", ""Wei Wang""]",IEEE Photonics Technology Letters,2017,10,0,https://ieeexplore.ieee.org/document/7932516/,"[""Beijing Key Laboratory of Low Dimensional Semiconductor Materials and Devices, Beijing, China""]","[""China""]","The design and fabrication of an evanescently coupled waveguide InGaAs unitraveling-carrier photodiode (PD) are presented. Through doping the InGaAs absorption layer gradedly, a large built-in electric field can be obtained. As a result, a 4-μm-wide 15-μm-long PD has a bandwidth larger than 21 GHz at zero bias. Passive input waveguide is integrated monolithically with the PD by a simple process, which eases the integration of PD with other optical components."
Thermal management of optically pumped long-wavelength InP-based semiconductor disk lasers,"[""H. Lindberg"", ""M. Strassner"", ""E. Gerster"", ""J. Bengtsson"", ""A. Larsson""]",IEEE Journal of Selected Topics in Quantum Electronics,2005,47,0,https://ieeexplore.ieee.org/document/1564051/,"[""Laboratory of Materials and Semiconductor Physics, Department of Microelectronics & Information Technology, Royal Institute of Technology, Kista, Sweden"", ""Photonics Laboratory, Department of Microtechnology and Nanoscience, Chalmers University of Technology, Gothenburg, Sweden"", ""Department of Optoelectronics, University of Ulm (EBS), Ulm, Germany""]","[""Sweden"", ""Germany""]","We have developed a numerical model for investigating material heating and its effects on the performance of optically pumped InP-based long-wavelength semiconductor disk lasers. Material heating and optical wavefront distortion due to thermal lensing are analyzed, and different approaches to reduce the intrinsic material heating are investigated numerically and experimentally. The results obtained indicate that material heating is significant in such lasers due to the poor thermal properties of the InP-based epitaxial layers of the gain chip. Substrate removal is shown to be an insufficient method to reduce the material heating; instead, crystalline heat spreaders bonded to the gain chip surface provide a convenient way to reduce the thermal impedance. Important parameters for such heat spreaders are a high thermal conductivity and a low thermooptic coefficient (dn/dT). With the use of a synthetic diamond heat spreader, a maximum pump limited output power of 780 mW in a near diffraction limited beam (M/sup 2/<1.2) was demonstrated at -33/spl deg/C and 100 mW at room temperature."
Tailoring of Energy Band in Electron-Blocking Structure Enhancing the Efficiency of AlGaN-Based Deep Ultraviolet Light-Emitting Diodes,"[""Xiaoli Ji"", ""Jianchang Yan"", ""Yanan Guo"", ""Lili Sun"", ""Tongbo Wei"", ""Yun Zhang"", ""Junxi Wang"", ""Fuhua Yang"", ""Jinmin Li""]",IEEE Photonics Journal,2016,17,0,https://ieeexplore.ieee.org/document/7457213/,"[""State Key Laboratory of Solid-State Lighting, Beijing Engineering Research Center for the Third Generation Semiconductor Materials and Application, Institute of Semiconductors, Chinese Academy of Sciences, Beijing, China"", ""Engineering Research Center for Semiconductor Integrated Technologies, Institute of Semiconductors, Chinese Academy of Sciences, Beijing, China""]","[""China""]","Impact Statement:Electron-leakage is a deep-rooted problem for nitride-based light-emitting diodes (LEDs), which is crucial for AlGaN-based deep-ultraviolet (DUV) LEDs. We propose a specific design about the electron-blocking structure in AlGaN DUV LEDs to counter the issue. Simulation results demonstrate this design can effectively reduce electron leakage. Fabricated devices with 292 nm emitting wavelength verify remarkably enhanced light-output power.Electron-leakage is a deep-rooted problem for nitride-based light-emitting diodes (LEDs), particularly for AlGaN-based deep-ultraviolet (DUV) LEDs. In this paper, a specific design for the electron-blocking structure in AlGaN DUV LEDs, increasing the Al composition of the last quantum barrier to the same value as that of the electron-blocking layer accompanied with composition-graded p-AlGaN layer, is proposed to reduce electron leakage. Simulation results demonstrate that this design can effectively reduce electron leakage and hence increase internal quantum efficiency. Furthermore, fabricated devices with at an emitting wavelength of 292 nm verify remarkably enhanced light-output power. At 20-mA injection current, the proposed structure achieved a light-output increment as high as 98%, compared with the conventional structure."
High-Uniformity and High Drain Current Density Enhancement-Mode AlGaN/GaN Gates-Seperating Groove HFET,"[""Yuangang Wang"", ""Yuanjie Lv"", ""Xingye Zhou"", ""Jiayun Yin"", ""Tingting Han"", ""Guodong Gu"", ""Xubo Song"", ""Xin Tan"", ""Shaobo Dun"", ""Hongyu Guo"", ""Yulong Fang"", ""Zhihong Feng"", ""Shujun Cai""]",IEEE Journal of the Electron Devices Society,2018,8,0,https://ieeexplore.ieee.org/document/8121975/,"[""National Key Laboratory of Application Specific Integrated Circuit, Hebei Semiconductor Research Institute, Shijiazhuang, China""]","[""China""]","In this paper, we report on a novel E-mode AlGaN/GaN gates-seperating groove heterostructure field-effect transistor (GSG HFET). The current turn-on/off is controlled by changing gate voltage to regulate the horizontal energy band between the double gates. A threshold voltage of 0.23 V and a high drain current density of 851 mA/mm are obtained in GSG HFET. Compared with the proposed depletion-mode device, the maximum drain current of the GSG HFET deceases slightly (about 7%). It is noteworthy that the threshold voltage is less sensitive to the etching time. The devices show high-uniformity threshold voltage of 0.23 V within wide etching time range from 5 to 9 min."
GaN-Based Frequency Doubler With Pulsed Output Power Over 1 W at 216 GHz,"[""Xubo Song"", ""Shixiong Liang"", ""Yuanjie Lv"", ""Zhenpeng Zhang"", ""Lisen Zhang"", ""Xingchang Fu"", ""Yanmin Guo"", ""Guodong Gu"", ""Yuangang Wang"", ""Yuan Fang"", ""Aimin Bu"", ""Shujun Cai"", ""Zhihong Feng""]",IEEE Electron Device Letters,2021,6,0,https://ieeexplore.ieee.org/document/9567695/,"[""National Key Laboratory of ASIC, Hebei Semiconductor Research Institute, Shijiazhuan, China""]","[""China""]","This letter reports a frequency doubler based on GaN Schottky barrier diodes (SBDs) with high pulse output power. An improved chip configuration with six anodes distributed in two rows was utilized to improve the power-handling capacity. An accurate diode model was developed from DC and small-signal S-parameters from 0.5 to 110 GHz. The frequency doubler was designed with a balanced structure and assembled with a flip-chip configuration. When a GaN-based high-power amplifier was used to drive the doubler, it delivered a peak output power of 1006 mW at 216 GHz with a corresponding conversion efficiency of 15%. The GaN-based frequency doubler shows potential for use in high-power terahertz source applications."
Investigation of Isoelectronic Doping in p-GaN Based on the Thermal Quenching of UVL Band,"[""Yang Huang"", ""Zhiqiang Liu"", ""Xiaoyan Yi"", ""Yao Guo"", ""Guodong Yuan"", ""JunXi Wang"", ""Guohong Wang"", ""Jinmin Li""]",IEEE Photonics Journal,2016,0,0,https://ieeexplore.ieee.org/document/7581116/,"[""Beijing Engineering Research Center for the Third Generation Semiconductor Materials and Application, Beijing, China"", ""R&D Center for Semiconductor Lighting, Chinese Academy of Sciences, Beijing, China""]","[""China""]","Impact Statement:A nondestructive diagnostic technique on the basis of thermal quenching of ultraviolet luminescence (UVL) band is proposed to acquire the dopant ionization energy of p-GaN grown with different trimethyindium (TMIn) flow rate, which reveals that isoelectronic doping with appropriate In incorporation is able to significantly reduce ionization energy of the acceptor, while excessive In incorporation will degenerate the conductivity of p-GaN.In this paper, isoelectronic doping with indium (In) in p-GaN is investigated on the basis of the thermal quenching of ultraviolet luminescence (UVL) band. A phenomenological rate-equation model is proposed as a nondestructive diagnostic technique to acquire the dopant ionization energy of p-GaN. In terms of this model, we analyze the evolution of the ionization energy of p-GaN samples grown with different trimethyindium flow rate and find that isoelectronic doping with appropriate In incorporation is able to significantly reduce the ionization energy of the acceptor from 245 to 112 meV, which are consistent with the results of the variable temperature Hall-effect measurements. The comparison between the samples’ full width at half maximum of the UVL band indicates that excessive In incorporation will degenerate the conductivity of p-GaN."
