Title,Author(s),Journal,Year,# times Cited (Papers),# times Cited (Patents),URL,Affiliations,Countries,Abstract
Rugged Electrical Power Switching in Semiconductors: A Systems Approach,"[""Krishna Shenai"", ""Michael Dudley"", ""Robert F. Davis""]",Proceedings of the IEEE,2014,16,0,https://ieeexplore.ieee.org/document/6595555/,"[""Energy Systems Division, Argonne National Laboratory, Argonne, IL, USA"", ""Department of Materials Science and Engineering, Carnegie Mellon University, Pittsburgh, PA, USA"", ""Department of Materials Science and Engineering, Sony Brook University, Stony Brook, NY, USA""]","[""United States""]","Current status of wide bandgap (WBG) semiconductor material technology is evaluated for developing high-performance and reliable power electronics switching converters. The study takes into account field reliability of silicon power metal-oxide-semiconductor field-effect transistors (MOSFETs) in compact computer/telecom power supplies where residual material defects present in the silicon space-charge region were found to generate local microplasma that eventually caused power MOSFETs to fail under long-term repetitive field-switching conditions. It is shown that silicon power MOSFETs with increased low-level leakage currents are more prone to field failures in high-density power supplies. A new single-event burnout (SEB) stress testing methodology is proposed; the SEB stress test results are shown to correlate well with silicon power MOSFET failures in power supply circuits. Based on these results and the current state of the art of silicon carbide (SiC) and gallium nitride (GaN) power devices, a “reliability-driven” manufacturing approach is recommended for rapid commercialization and market penetration of WBG semiconductor power devices."
Single-mode semiconductor lasers for long-wavelength optical fiber communications and dynamics of semiconductor lasers,"[""Y. Suematsu"", ""S. Arai""]",IEEE Journal of Selected Topics in Quantum Electronics,2000,0,0,https://ieeexplore.ieee.org/document/902199/,"[""Tokyo Institute of Technology, Research Center for Quantum Effect Electronics, Tokyo, Japan"", ""Kochi University of Technology, Kochi, Japan""]","[""Japan""]","Research activities devoted to long-wavelength optical fiber communications, especially for single-mode semiconductor lasers at the long-wavelength range of 1.5 /spl mu/m and the dynamics of their lasing wavelength properties, which limit the transmission bandwidth of a single-mode fiber, are reviewed. Advanced semiconductor lasers based on the single-mode operating nature, such as wavelength tunable lasers and photonic integrated circuits are also reviewed."
A Testbed for Simulating Semiconductor Supply Chains,"[""Hanna Ewen"", ""Lars M\u00f6nch"", ""Hans Ehm"", ""Thomas Ponsignon"", ""John W. Fowler"", ""Lisa Forstner""]",IEEE Transactions on Semiconductor Manufacturing,2017,27,0,https://ieeexplore.ieee.org/document/7944690/,"[""Infineon Technologies AG, Neubiberg, Germany"", ""Department of Supply Chain Management, Arizona State University, Tempe, AZ, USA"", ""University of Hagen, Hagen, Germany""]","[""United States"", ""Germany""]","In this paper, a supply chain simulation testbed for the semiconductor industry is proposed. We start by identifying requirements for such reference datasets, and then we identify the main building blocks. The nodes of the supply chain that represent semiconductor wafer fabrication facilities (wafer fabs) are built on a simulation model from the measurement and improvement of manufacturing capacity project. We present two techniques to reduce the modeling and computational burden that are able to deal with load-dependent cycle times in single front-end and back-end facilities and in the overall network. The first method models in detail only the bottlenecks in the nodes of the supply chain, while the second one uses empirical distributions for cycle time and throughput. The quality of these reduction techniques is assessed by comparing the detailed model and the models with a reduced level of detail. We present an application scenario for the testbed by simulating a semiconductor supply network. In addition, the usage of the testbed is discussed."
Resource conservation of buffered HF in semiconductor manufacturing,"[""Y. Inagaki"", ""M. Shimizu""]",IEEE Transactions on Semiconductor Manufacturing,2002,0,0,https://ieeexplore.ieee.org/document/1134157/,"[""Semiconductor Network Company Sony Corporation, Kanagawa, Japan"", ""The Technical Solutions Center, Sony Corporation, Yokohama, Japan""]","[""Japan""]","With buffered hydrogen fluoride (BHF) treatment, the etch rate of thermal oxide gradually increases over time. Thus, the old BHF must be frequently changed to new BHF in order to maintain the etch rate. As a result, considerable BHF and other chemicals to treat waste BHF are consumed and considerable waste such as sludge and wastewater is discharged. We have developed a new method to maintain the etch rate by supplying ammonia and water evaporated from BHF. The amount depends on the amount of NH/sub 4/F/HF in BHF. Since the method can extend the usable lifetime of BHF, it will help to reduce BHF used and the chemicals required to treat waste BHF and decrease the discharge of wastewater and sludge."
Fundamental and Subharmonic Hybrid Mode-Locking of a High-Power (220 mW) Monolithic Semiconductor Laser,"[""Faisal R. Ahmad"", ""Farhan Rana""]",IEEE Photonics Technology Letters,2008,21,0,https://ieeexplore.ieee.org/document/4563476/,"[""Department of Physics, Cornell University, Ithaca, NY, USA"", ""School of Electrical and Computer Engineering, Cornell University, Ithaca, NY, USA""]","[""United States""]",We report on the generation of stable optical pulses at 1.55- mum wavelength via fundamental and subharmonic hybrid mode-locking of a high-power electrically pumped semiconductor diode laser with a slab-coupled optical waveguide structure. The highest average power measured in mode-locked operation was 220 mW. This is the highest power reported for a hybrid mode-locked monolithic semiconductor laser. We also measure the phase (or timing) noise during fundamental and subharmonic operation and our measurements show good agreement with theory.
Design of Ultra-Small Metallic-Semiconductor Nano-Ring Cavity Lasers,"[""Chee-Wei Lee"", ""Qian Wang"", ""Gurpreet Singh"", ""Seng-Tiong Ho""]",IEEE Photonics Technology Letters,2013,4,0,https://ieeexplore.ieee.org/document/6512587/,"[""Department of Electrical Engineering and Computer Science, Northwestern University, Evanston, IL, USA"", ""Data Storage Institute, Agency for Science, Technology and Research, Singapore""]","[""Singapore"", ""United States""]","We present design and analysis of metallic-semiconductor nanoring laser lasing at around 1450 nm wavelength, utilizing a body-of-revolution finite-difference-time-domain (BOR-FDTD) simulation incorporated with a semiclassical multilevel model for semiconductor gain medium and the Drude-Lorentz model for metal, which is developed for efficient simulation of disk/ring plasmonic laser. As compared to other literature, our nanoring laser works in radial mode with resonance cycle, m =1, which could facilitate potential in-plane out-coupling, and is wafer bonded onto Si platform for potential electronic-photonic integration. The total footprint, the physical device volume, and the effective mode volume of the nanolaser are only about 0.038 μm 2 , 1.1(λ/2 n ) 3 , and 0.001(λ/2 n ) 3 , respectively, where n is the average refractive index of the gain medium. To the best of our knowledge, our nanolaser is the smallest reported to date."
High Peak Power Operation of a 1- μ m GaAs-Based Optically Pumped Semiconductor Laser,"[""Alexandre Laurain"", ""Tsuei-Lian Wang"", ""Michael J. Yarborough"", ""Jorg Hader"", ""Jerome V. Moloney"", ""Stephan W. Koch"", ""Bernardette Kunert"", ""Wolfgang Stolz""]",IEEE Photonics Technology Letters,2012,3,0,https://ieeexplore.ieee.org/document/6104100/,"[""Department of Physics, Material Science Center, Philipps Universit\u00e4t Marburg, Marburg, Germany"", ""College of Optical Sciences, University of Arizona Tucson, Tucson, AZ, USA""]","[""United States"", ""Germany""]",We report room-temperature high-peak-power operation of an optically pumped semiconductor laser based on the InGaAs/GaAs material system. We present the design of the semiconductor structure and optimization strategies to extract the maximum pulsed peak power. The gain structure was pumped by a 775-nm Alexandrite laser with a pulsewidth adjustable from 400 ns to 1 μs and a repetition rate of 3 Hz. A new record peak power of 400 W at a wavelength of 1020 nm was obtained with a Gaussian-shaped submicrosecond pulse. An optical-to-optical efficiency of 28% is demonstrated at maximum power. The key parameters limiting the output power are discussed.
Electric Field Effects in Semiconductor Spin Transport—A Transfer Matrix Formalism,"[""Arunanshu M. Roy"", ""Dmitri E. Nikonov"", ""Krishna C. Saraswat""]",IEEE Transactions on Magnetics,2011,1,0,https://ieeexplore.ieee.org/document/6027833/,"[""Department of Electrical Engineering, Stanford University, Stanford, CA, USA"", ""Components Research, Intel Corporation, Santa Clara, CA, USA""]","[""United States""]","A transfer matrix method for simulating spin injection into semiconductors in the case of high electric fields has been developed. The nonlinear relationship between electron spin density and electrochemical potential splitting, the effect of electric field on spin diffusion lengths, and spin polarized drift current are accounted for. Using this approach, high magnetoresistance (MR) at high electric fields is predicted. This is due to spin accumulation reaching its extreme values for fermion statistics. This effect opens up a new direction for solving the problem of low MR that semiconductor spintronic devices are facing."
Single Transverse-Mode Semiconductor Laser Arrays by Parity-Time Symmetry Breaking,"[""Sikang Yang"", ""Yu Han"", ""Ruigang Zhang"", ""Qi Tian"", ""Pengxiang He"", ""Deming Liu"", ""Minming Zhang""]",IEEE Photonics Technology Letters,2023,0,0,https://ieeexplore.ieee.org/document/10121457/,"[""School of Optical and Electronic Information, Huazhong University of Science and Technology, Wuhan, China""]","[""China""]","Electrically pumped semiconductor laser array operating in the fundamental mode is of vital importance. In general, the competition of multiple transverse modes in the laser array leads to spatiotemporally unstable and degradation of beam quality. In this letter, we propose and experimentally demonstrate electrically pumped single transverse-mode semiconductor laser arrays by exploiting the concept of parity-time symmetry, which is insensitive to fabrication and frequency detuning. Laser arrays composed of four, six and ten-ridge gain lattice have been fabricated, and single transverse-mode operations are observed from the spectral response and far-field radiation. Insensitivity to the fabrication have also been experimentally demonstrated by varying the gap from1.06μmto1.42μm. The emission power of PT-symmetric laser arrays composed of a four-ridge gain lattice is about five times higher than that of the single-ridge laser with the same current density."
High-Frequency Switching Properties and Low Oxide Electric Field and Energy Loss in a Reverse-Channel 4H-SiC UMOSFET,"[""Zhanwei Shen"", ""Feng Zhang"", ""Guoguo Yan"", ""Zhengxin Wen"", ""Wanshun Zhao"", ""Lei Wang"", ""Xingfang Liu"", ""Guosheng Sun"", ""Yiping Zeng""]",IEEE Transactions on Electron Devices,2020,7,0,https://ieeexplore.ieee.org/document/9142412/,"[""Key Laboratory of Semiconductor Material Sciences, Institute of Semiconductors, Chinese Academy of Sciences, Beijing, China""]","[""China""]","A reverse-channel 4H-SiC trench gate metaloxide-semiconductor field-effect transistor (UMOSFET) (RC-MOS) is proposed in this article. The RC-MOS is demonstrated to have low specific ON-resistance (RON,sp) by numerical simulation. The trench oxide in the RC-MOS is fully protected by the n+ source, the p-shield, and the p-base regions. Thus, a reduced trench corner field far below 3 MV/cm can be achieved in both the OFFand ON-state. Furthermore, the gate-to-drain charge (QGD) of the RC-MOS is 33 nC/cm 2 , which is much lower than that of the dual buffer layer MOSFET (DB-MOS), owing to little overlap between the gate and drain electrodes. Consequently, the RC-MOS exhibits the superior figures of merit QGD x RON,sp = 82 mΩ·nC. Due to the low reverse transfer capacitance and gate charges in the RC-MOS, the total switching loss of 570 μJ/cm 2 is decreased by 64.5% in comparison to that of the DB-MOS. These superior properties show that the proposed UMOSFET can be a good candidate for further improvements in the gate oxide reliability and high-frequency performance of SiC MOSFETs."
Measurement of Linewidth Enhancement Factor for 1.3- $\mu{\rm m}$ InAs/GaAs Quantum Dot Lasers,"[""Jin-Long Xiao"", ""Chu-Cai Guo"", ""Hai-Ming Ji"", ""Peng-Fei Xu"", ""Qi-Feng Yao"", ""Xiao-Meng Lv"", ""Ling-Xiu Zou"", ""Heng Long"", ""Tao Yang"", ""Yong-Zhen Huang""]",IEEE Photonics Technology Letters,2013,4,0,https://ieeexplore.ieee.org/document/6420872/,"[""Key Laboratory of Semiconductor Materials Science, Institute of Semiconductors, Chinese Academy of Sciences, Beijing, China"", ""College of Optoelectric Science and Engineering, National University of Defense Technology, Changsha, China"", ""State Key Laboratory on Integrated Optoelectronics, Institute of Semiconductors, Chinese Academy of Sciences, Beijing, China""]","[""China""]","We present a procedure for determining the linewidth enhancement factor (αfactor) of semiconductor lasers under continuous-wave operation with a proper correction of thermal effects. Gain spectra are measured by the Fourier series expansion method, and the variations of refractive index are determined by the mode wavelength shift and Kramers–Kronig relation, respectively. Theαfactors are measured in a wide wavelength range from 1170 to 1320 nm for an InAs/GaAs quantum dot (QD) laser with a cavity length of 440μm. Theαfactors of 0.42 and 0.79 are obtained at gain peak wavelength of 1210 nm for the excited state at the injection currents of 40 and 60 mA, and the corresponding values of 1.97 and 3.97 are obtained at a wavelength of 1285 nm, respectively. The results show a relative lowαfactor at the gain peak position of QD excited state. We also calculate theoretically the optical gain andαfactor for the QD laser, and compare with the experimental results. The results indicate that high injection current will result in higherαfactor due to the appearance of asymmetry gain spectrum."
Theoretical and Experimental Study of a Semiconductor Resonant Cavity Linear Interferometric Intensity Modulator,"[""Nazanin Hoghooghi"", ""Peter J. Delfyett""]",Journal of Lightwave Technology,2011,3,0,https://ieeexplore.ieee.org/document/6029405/,"[""CREOL, The College of Optics and Photonics, University of Central Florida, Orlando, FL, USA""]","[""United States""]","The phase response of an injection locked semiconductor laser that is used as the phase modulator in a resonant cavity linear interferometric intensity modulator is studied in detail. It is shown that, signal-to-intermodulation ratio of such a modulator is affected by the injection ratio, linewidth enhancement factor of the semiconductor laser, residual amplitude modulation, depth of phase modulation, and linearity of the resonant cavity response. Experimental measurements of the signal-to-intermodulation ratio of this modulator using a semiconductor Fabry-Pérot laser as the resonant cavity are in good agreement with the theoretically predicted values."
Impact of Water Content in NMP on Ohmic Contacts in GaN HEMT Technologies,"[""Alexander Hugger"", ""Aleksandra Dlugolecka"", ""Hermann Stieglauer"", ""Raphael Ehrbrecht"", ""Michael Hosch""]",IEEE Transactions on Semiconductor Manufacturing,2020,1,0,https://ieeexplore.ieee.org/document/9211805/,"[""United Monolithic Semiconductors GmbH, Ulm, Germany""]","[""Germany""]","Wet chemical lift off in N-Methyl-2-pyrrolidone (NMP) is widely used in GaN HEMT Front End manufacturing. In case of a Ti-Al-Ni-Au based metal stack for ohmic contacts, the quality of the lift-off process is a strong function of the water content in the solvent NMP. In this article, it will be shown that the metal stack can be attacked during lift off in NMP when its water content is exceeding 5%. Additionally, environmental impacts on the hygroscopy of NMP are investigated. Both temperature of NMP and its contact area to air impact the evolution of its water content. Based on these investigations, the lift off sequence was slightly adapted in order to keep moisture below a certain level and avoid optical defects on ohmic contacts."
Quantifying Optical Feedback Into Semiconductor Lasers via Thermal Profiling,"[""E.W. Kapusta"", ""D. Lueren"", ""J.A. Hudgings""]",IEEE Photonics Technology Letters,2006,4,0,https://ieeexplore.ieee.org/document/1643728/,"[""Physics Department, Mount Holyoke College, South Hadley, MA, USA""]","[""United States""]","We show that thermal profiling can be used to monitor optical feedback into semiconductor lasers in photonic integrated circuits, where direct optical access is impractical. The optical output power of a laser, both free-running and when exposed to optical feedback, can be quantitatively determined from thermal measurements alone, without recourse to direct optical measurements. Furthermore, the shift in threshold current resulting from optical feedback can be determined from the thermal measurements, enabling quantitative determination of the feedback coupling efficiency into the laser."
Monolithically Integrated Four-Channel DFB Semiconductor Laser Array With an Equivalent-Distributed Coupling Coefficient,"[""Junshou Zheng"", ""Yuechun Shi"", ""Yunshan Zhang"", ""Jilin Zheng"", ""Jun Lu"", ""Xiangfei Chen""]",IEEE Photonics Journal,2015,3,0,https://ieeexplore.ieee.org/document/7085997/,"[""Institute of Communication Engineering, PLA University of Science and Technology, Nanjing, China"", ""National Laboratory of Solid State Microstructures, College of Engineering and Applied Sciences, Nanjing University, Nanjing, China"", ""Nanjing University (Suzhou) High-Tech Institute, Suzhou, China""]","[""China""]","An equivalent-distributed coupling coefficient (EDCC) distributed feedback (DFB) semiconductor laser is proposed, and a four-channel EDCC DFB laser array is experimentally demonstrated. In this paper, the EDCC grating profile is realized by varying the duty cycle of a certain subsection of the whole sampled Bragg grating (SBG) along the laser cavity, instead of the true DCC structure obtained by changing the height of the uniform grating pitch. Moreover, the EDCC grating array can be designed by stepping the sampling period of the SBG and fabricated by combining the conventional holographic exposure with a micrometer-level photolithography on the same wafer. The experimental results show that the uniform channel spacing in the array has been obtained and that the residual of the lasing wavelengths after linear fitting changes in the scope of -0.078 and 0.048 nm. Each laser has good single longitudinal mode operation with the minimum side-mode suppression ratio (SMSR) of about 47.65 dB and the average SMSR of 49.83 dB under the same injection current of 80 mA."
DFB Semiconductor Laser With Discrete Coupling Coefficient Based on the Equivalent Technique,"[""Junshou Zheng"", ""Duotian Xia"", ""Song Tang"", ""Yuechun Shi"", ""Jilin Zheng"", ""Jun Lu"", ""Xiangfei Chen"", ""Yunshan Zhang""]",IEEE Photonics Journal,2015,1,0,https://ieeexplore.ieee.org/document/7097652/,"[""College of Engineering and Applied Sciences, Nanjing University, Nanjing, China"", ""Institute of Communication Engineering, PLA University of Science and Technology, Nanjing, China"", ""Nanjing University (Suzhou) High-Tech Institute, Suzhou, China""]","[""China""]","An equivalently discrete coupling coefficient (EDCC) distributed feedback (DFB) semiconductor laser with EDCC grating is numerically investigated and experimentally demonstrated; the EDCC grating structure is designed by discretizing the duty cycle of sampled Bragg grating along the laser cavity, i.e., the cavity is divided into some subsections, and the duty cycle is constant in each subsection while it is different between two adjacent subsections, instead of the truly discrete coupling coefficient grating profile realized by discontinuously varying the duty cycle and/or etching depth of the uniform gating pitch. Moreover, the EDCC grating is fabricated by combining the conventional holographic exposure with a micrometer-level photolithography, which will simplify the fabrication process and reduce the fabrication cost. Based on experimental data, the analysis of spectral behavior as a function of injection current shows that the stable single-longitudinal-mode operation has been realized, even at large injection current and high temperature."
Nonpolar AlGaN/GaN Metal–Insulator–Semiconductor Heterojunction Field-Effect Transistors With a Normally Off Operation,"[""Masayuki Kuroda"", ""Tetsuzo Ueda"", ""Tsuyoshi Tanaka""]",IEEE Transactions on Electron Devices,2010,30,0,https://ieeexplore.ieee.org/document/5373961/,"[""Semiconductor Device Research Center, Semiconductor Company, Panasonic Corporation, Kyoto, Japan""]","[""Japan""]","Nonpolar AlGaN/GaN metal-insulator-semiconductor-heterojunction field-effect transistors (MIS-HFETs) with a complete normally off operation have been demonstrated for the first time. To realize the normally off operation of the MIS-HFETs, a 2-nm-thick SiN (as an insulator) and GaN-based nonpolar epitaxial layers that are free from polarization charges are employed. We have found that a thicker nonpolar AlN buffer layer achieves a GaN layer with a narrower full width at half maximum of the X-ray rocking curve and higher electron mobility. The fabricated MIS gate structure on the AlN buffer layer successfully decreases the gate leakage current and enables a more positive gate bias of up to +4 V, which is advantageous to achieve a higher drain current. Moreover, the n-GaN capping layer between gate and ohmic electrodes helps to reduce parasitic resistance and suppress current collapse. The fabricated a -plane MIS-HFET exhibits a threshold voltage of + 1.3 V with a high drain current of 112 mA/mm. The presented MIS-HFETs will be desirable in next-generation radio-frequency and power switching application fields."
Record Effective Mobility Obtained From In0.53Ga0.47As/In0.52Al0.48As Quantum-Well MOSFETs on 300-mm Si Substrate,"[""Seung-Woo Son"", ""Jung Ho Park"", ""Ji-Min Baek"", ""Do-Kwyn Kim"", ""Seung Ryul Lee"", ""Sang-Moon Lee"", ""Jieon Yoon"", ""Jungtaek Kim"", ""Woo-Bin Song"", ""Sunjung Kim"", ""Dong Suk Shin"", ""Yihwan Kim"", ""Seung Heon Shin"", ""Tae-Woo Kim"", ""Jung-Hee Lee"", ""Dae-Hyun Kim""]",IEEE Electron Device Letters,2017,9,0,https://ieeexplore.ieee.org/document/7904702/,"[""Kyungpook National University, Daegu, South Korea"", ""The University of Texas at Austin, Austin, TX, USA"", ""School of Electrical Engineering, University of Ulsan, Ulsan, South Korea"", ""Samsung Semiconductor R&D Center, Samsung Electronics, Hwaseong-si, South Korea""]","[""South Korea"", ""United States""]","In this letter, we have investigated the properties of In 0.53 Ga 0.47 As quantum-well (QW) metal–oxide–semiconductor field-effect-transistors (MOSFETs) on a 300-mm(100) Si wafer. We have explored the impact of scaling down In 0.53 Ga 0.47 As channel thickness (tch)from 15 to 5 nm. The fabricated devices show excellent electrostatic integrity, such as subthreshold-swing (SS) < 80 mV/decade and drain-induced barrier-lower (DIBL) <20 mV/V. Furthermore, we have extracted the effective mobility (μn_eff)of the fabricated devices to investigate the carrier transport properties of the InGaAs MOSFETs with different values oftch. The device withtch=15nm displayed a value ofμn_eff=2,190cm 2 /V-s at room temperature. This valuewas found to decrease astchwas scaled down."
Projection pursuit for analyzing data from semiconductor environments,"[""T. Rohatsch"", ""G. Poppel"", ""H. Werner""]",IEEE Transactions on Semiconductor Manufacturing,2006,3,0,https://ieeexplore.ieee.org/document/1588866/,"[""Universit\u00e4t Kassel, Kassel, Germany"", ""Infineon Technologies, Regensburg, Germany""]","[""Germany""]","Complex environments with complex productions lead to complex data; this certainly applies to the work on semiconductors. Acquiring the data offers a challenge, and the challenge only grows when attempting to analyze the data structures and dependencies. We put forward the well-known Projection Pursuit method; it has apparently not yet been used so far in the production of semiconductors. Extensions of this method are introduced which include robust index functions, new optimizing strategies, and an approach to analyzing the dependencies between different groups of variables."
