,Keys,Values
509,"Department of Materials Science, University of Tohoku, Sendai, Japan","['Telecommunication Advancements Organization, Sendai Research Center, Sendai, Japan']"
510,"Departamento de Física e Ingeniería Nuclear, Universitat Poliltècnica de Catalunya, Terrassa, Spain","['Departamento de Fisica, Universidad Rey Juan Carlos de Madrid, Mostoles, Spain']"
511,"Departamento de Fisica, Universidad Rey Juan Carlos de Madrid, Mostoles, Spain","['Departamento de Física e Ingeniería Nuclear, Universitat Poliltècnica de Catalunya, Terrassa, Spain']"
512,"School of Electronics and Information Engineering, Sichuan University, Chengdu, China","['State Key Laboratory of Millimeter Waves, Southeast University, Nanjing, China', 'School of Physics, Southwest University, Chongqing, China']"
513,"EPSRC Central Facility for III-V Semiconductors, Department of Electronic and Electrical Engineering, University of Sheffield, Sheffield, UK","['Department of Physics and Astronomy, University of Southampton, Southampton, UK', 'Ultrafast Laser Physics, Institute of Quantum Electronics, Swiss Federal Institute of Technology, ETH Hönggerberg, Zurich, Switzerland']"
514,"Department of Physics and Astronomy, University of Southampton, Southampton, UK","['Ultrafast Laser Physics, Institute of Quantum Electronics, Swiss Federal Institute of Technology, ETH Hönggerberg, Zurich, Switzerland', 'EPSRC Central Facility for III-V Semiconductors, Department of Electronic and Electrical Engineering, University of Sheffield, Sheffield, UK']"
515,"Ultrafast Laser Physics, Institute of Quantum Electronics, Swiss Federal Institute of Technology, ETH Hönggerberg, Zurich, Switzerland","['Department of Physics and Astronomy, University of Southampton, Southampton, UK', 'EPSRC Central Facility for III-V Semiconductors, Department of Electronic and Electrical Engineering, University of Sheffield, Sheffield, UK']"
516,"Laboratory for Electric Packaging Material and Technology, Hitachi Chemical Company Limited, Ibaraki, Japan","['Semiconductor Material Division, Hitachi Chemical Company Limited, Ibaraki, Japan']"
517,"Semiconductor Material Division, Hitachi Chemical Company Limited, Ibaraki, Japan","['Laboratory for Electric Packaging Material and Technology, Hitachi Chemical Company Limited, Ibaraki, Japan']"
518,"imec, Leuven, Belgium","['International College of Semiconductor Technology, National Yang Ming Chiao Tung University, Hsinchu, Taiwan']"
519,"Department of Electrical Engineering, IIT Kanpur, Kanpur, India",[]
520,"Suzhou Institute of Biomedical Engineering and Technology, Chinese Academy of Sciences, Suzhou, China","['Department of Electronic and Computer Engineering, The Hong Kong University of Science and Technology, Hong Kong, China', 'School of Electronics and Information Technology, Sun Yat-sen University, Guangzhou, China', 'College of Integrated Circuit Science and Engineering, Nanjing University of Posts and Telecommunications, Nanjing, China', 'School of Integrated Circuits, Guangdong University of Technology, Guangzhou, China', 'School of Information Science and Engineering, Shandong University, Qingdao, China', 'School of Electronic and Computer Engineering, Shenzhen Graduate School, Peking University, Shenzhen, China']"
521,"School of Electronics and Information Technology, Sun Yat-sen University, Guangzhou, China","['Department of Electronic and Computer Engineering, The Hong Kong University of Science and Technology, Hong Kong, China', 'College of Integrated Circuit Science and Engineering, Nanjing University of Posts and Telecommunications, Nanjing, China', 'School of Integrated Circuits, Guangdong University of Technology, Guangzhou, China', 'School of Information Science and Engineering, Shandong University, Qingdao, China', 'Suzhou Institute of Biomedical Engineering and Technology, Chinese Academy of Sciences, Suzhou, China', 'School of Electronic and Computer Engineering, Shenzhen Graduate School, Peking University, Shenzhen, China']"
522,"School of Information Science and Engineering, Shandong University, Qingdao, China","['Department of Electronic and Computer Engineering, The Hong Kong University of Science and Technology, Hong Kong, China', 'School of Electronics and Information Technology, Sun Yat-sen University, Guangzhou, China', 'College of Integrated Circuit Science and Engineering, Nanjing University of Posts and Telecommunications, Nanjing, China', 'School of Integrated Circuits, Guangdong University of Technology, Guangzhou, China', 'Suzhou Institute of Biomedical Engineering and Technology, Chinese Academy of Sciences, Suzhou, China', 'School of Electronic and Computer Engineering, Shenzhen Graduate School, Peking University, Shenzhen, China']"
523,"School of Electronic and Computer Engineering, Shenzhen Graduate School, Peking University, Shenzhen, China","['Department of Electronic and Computer Engineering, The Hong Kong University of Science and Technology, Hong Kong, China', 'School of Electronics and Information Technology, Sun Yat-sen University, Guangzhou, China', 'College of Integrated Circuit Science and Engineering, Nanjing University of Posts and Telecommunications, Nanjing, China', 'School of Integrated Circuits, Guangdong University of Technology, Guangzhou, China', 'School of Information Science and Engineering, Shandong University, Qingdao, China', 'Suzhou Institute of Biomedical Engineering and Technology, Chinese Academy of Sciences, Suzhou, China']"
524,"Department of Electronic and Computer Engineering, The Hong Kong University of Science and Technology, Hong Kong, China","['School of Electronics and Information Technology, Sun Yat-sen University, Guangzhou, China', 'College of Integrated Circuit Science and Engineering, Nanjing University of Posts and Telecommunications, Nanjing, China', 'School of Integrated Circuits, Guangdong University of Technology, Guangzhou, China', 'School of Information Science and Engineering, Shandong University, Qingdao, China', 'Suzhou Institute of Biomedical Engineering and Technology, Chinese Academy of Sciences, Suzhou, China', 'School of Electronic and Computer Engineering, Shenzhen Graduate School, Peking University, Shenzhen, China']"
525,"College of Integrated Circuit Science and Engineering, Nanjing University of Posts and Telecommunications, Nanjing, China","['Department of Electronic and Computer Engineering, The Hong Kong University of Science and Technology, Hong Kong, China', 'School of Electronics and Information Technology, Sun Yat-sen University, Guangzhou, China', 'School of Integrated Circuits, Guangdong University of Technology, Guangzhou, China', 'School of Information Science and Engineering, Shandong University, Qingdao, China', 'Suzhou Institute of Biomedical Engineering and Technology, Chinese Academy of Sciences, Suzhou, China', 'School of Electronic and Computer Engineering, Shenzhen Graduate School, Peking University, Shenzhen, China']"
526,"School of Integrated Circuits, Guangdong University of Technology, Guangzhou, China","['Department of Electronic and Computer Engineering, The Hong Kong University of Science and Technology, Hong Kong, China', 'School of Electronics and Information Technology, Sun Yat-sen University, Guangzhou, China', 'College of Integrated Circuit Science and Engineering, Nanjing University of Posts and Telecommunications, Nanjing, China', 'School of Information Science and Engineering, Shandong University, Qingdao, China', 'Suzhou Institute of Biomedical Engineering and Technology, Chinese Academy of Sciences, Suzhou, China', 'School of Electronic and Computer Engineering, Shenzhen Graduate School, Peking University, Shenzhen, China']"
527,"Institute of Energy Technology, Lappeenranta University of Technology, Lappeenranta, Finland","['ABB Corporate Research, Zurich, Switzerland']"
528,"ABB Corporate Research, Zurich, Switzerland","['Institute of Energy Technology, Lappeenranta University of Technology, Lappeenranta, Finland']"
529,"Departament de Física, Universitat de les Illes Balears, Palma de Mallorca, Spain","['Weierstrass Institute of Applied Analysis and Stochastics, Berlin, Germany', ""Institut mediterrani d'Estudis Avançats, Esporles, Spain""]"
530,"Institut mediterrani d'Estudis Avançats, Esporles, Spain","['Weierstrass Institute of Applied Analysis and Stochastics, Berlin, Germany', 'Departament de Física, Universitat de les Illes Balears, Palma de Mallorca, Spain']"
531,"Weierstrass Institute of Applied Analysis and Stochastics, Berlin, Germany","['Department of Applied Mathematics, University College Cork, Cork, Ireland', 'Departament de Física, Universitat de les Illes Balears, Palma de Mallorca, Spain', ""Institut mediterrani d'Estudis Avançats, Esporles, Spain""]"
532,"Institute of Microelectronics and Department of Electrical Engineering, National Cheng Kung University, Tainan, Taiwan",[]
533,"The University of Tokyo, VLSI Design and Education Center (VDEC), Tokyo, Japan","['Semiconductor Energy Laboratory Co., Ltd., Atsugi-shi, Kanagawa, Japan']"
534,"Semiconductor Energy Laboratory Co., Ltd., Atsugi-shi, Kanagawa, Japan","['The University of Tokyo, VLSI Design and Education Center (VDEC), Tokyo, Japan']"
535,"Walter Schottky Institute, Technical University Munich, Garching, Germany","['State Key Laboratory on Integrated Optoelectronics, Institute of Semiconductors, Chinese Academy and Sciences, Beijing, China']"
536,"Department of Precision Instruments, Tsinghua University, Beijing, China",[]
537,"Air Force Institute of Technology, Wright-Patterson AFB, OH, USA","['Autani, LLC, TN', 'Autani, LLC, Nashville, TN, USA', 'Air Force Research Laboratory, Kirtland AFB, NM, USA']"
538,"Autani, LLC, Nashville, TN, USA","['Air Force Research Laboratory, Kirtland AFB, NM, USA', 'Air Force Institute of Technology, Wright-Patterson AFB, OH, USA']"
539,"Air Force Research Laboratory, Kirtland AFB, NM, USA","['Autani, LLC, Nashville, TN, USA', 'Air Force Institute of Technology, Wright-Patterson AFB, OH, USA']"
540,"School of Electrical Engineering, Korea University, Seoul, South Korea","['School of Electrical Engineering, Korea Advanced Institute of Science and Technology, Daejeon, South Korea', 'School of Electrical and Computer Engineering, University of Seoul, Seoul, South Korea']"
541,"School of Electrical Engineering, Korea Advanced Institute of Science and Technology, Daejeon, South Korea","['School of Electrical Engineering, Korea University, Seoul, South Korea', 'School of Electrical and Computer Engineering, University of Seoul, Seoul, South Korea']"
542,"School of Electrical and Computer Engineering, University of Seoul, Seoul, South Korea","['School of Electrical Engineering, Korea Advanced Institute of Science and Technology, Daejeon, South Korea', 'School of Electrical Engineering, Korea University, Seoul, South Korea']"
543,"Science and Technology on Electro-Optical Information Security Control Laboratory, Tianjin, China","['Key Laboratory of Semiconductor Materials Science, Institute of Semiconductors, Chinese Academy of Sciences, Beijing, China']"
544,"Art Innovation B.V., Oldenzaal, EJ, Netherlands","['Department of Science and Technology, University of Twente, Enschede, AE, Netherlands']"
545,"Department of Science and Technology, University of Twente, Enschede, AE, Netherlands","['Art Innovation B.V., Oldenzaal, EJ, Netherlands']"
546,"State Key Laboratory of Crystal Materials and the Institute of Novel Semiconductors, Shandong University, Jinan, China","['Institute of Fluid Physics, China Academy of Engineering Physics, Mianyang, China']"
547,"College of Mechanical Engineering, Donghua University, Shanghai, China","['School of Mechanical Engineering, Shanghai Jiao Tong University, Shanghai, China']"
548,"School of Mechanical Engineering, Shanghai Jiao Tong University, Shanghai, China","['College of Mechanical Engineering, Donghua University, Shanghai, China']"
549,"NTT Device Innovation Center, Nippon Telegraph and Telephone Corporation, Atsugi, Kanagawa, Japan",[]
550,"Toshiba Research and Development Center, Kawasaki, Japan","['Semiconductor Company, Toshiba Corporation, Kawasaki, Japan']"
551,"Semiconductor Company, Toshiba Corporation, Kawasaki, Japan","['Toshiba Research and Development Center, Kawasaki, Japan']"
552,"Department of Electrical and Computer Engineering, Queen's University, Kingston, Canada",[]
553,"Center for Semiconductor Research and Development, Semiconductor and Storage Company, Toshiba Corporation, Kawasaki, Japan","['Advanced LSI Technology Laboratory, Corporate Research and Development Center, Toshiba Corporation, Kawasaki, Japan']"
554,"Advanced LSI Technology Laboratory, Corporate Research and Development Center, Toshiba Corporation, Kawasaki, Japan","['Center for Semiconductor Research and Development, Semiconductor and Storage Company, Toshiba Corporation, Kawasaki, Japan']"
555,"Institute of Microelectronics, Peking University, Beijing, China",[]
556,"The Australian Photonics Cooperative Research Centre Department of Electrical and ElectronicEngineering, University of Melbourne, VIC, Australia","['The Australian PhotonicsCooperative Research Centre Department of Electrical and ElectronicEngineering, University of Melbourne, VIC, Australia', 'The Semiconductor Technology Laboratory, Oki Electric Industry Company Limited, Hachioji, Tokyo, Japan']"
557,"The Semiconductor Technology Laboratory, Oki Electric Industry Company Limited, Hachioji, Tokyo, Japan","['The Australian Photonics Cooperative Research Centre Department of Electrical and ElectronicEngineering, University of Melbourne, VIC, Australia', 'The Australian PhotonicsCooperative Research Centre Department of Electrical and ElectronicEngineering, University of Melbourne, VIC, Australia']"
558,"The Australian PhotonicsCooperative Research Centre Department of Electrical and ElectronicEngineering, University of Melbourne, VIC, Australia","['The Australian Photonics Cooperative Research Centre Department of Electrical and ElectronicEngineering, University of Melbourne, VIC, Australia', 'The Semiconductor Technology Laboratory, Oki Electric Industry Company Limited, Hachioji, Tokyo, Japan']"
559,"Department of Industrial Management, National Taiwan University of Science and Technology, Taipei, Taiwan",[]
560,"Department of Chemistry, Gwangju Institute of Science and Technology (GIST), Gwangju, South Korea","['School of Electrical Engineering and Computer Science, Gwangju Institute of Science and Technology (GIST), Gwangju, South Korea', 'Department of Energy Engineering, Power Semiconductor Concentration, Korea Institute of Energy Technology (KENTECH), Naju, South Korea']"
561,"School of Electrical Engineering and Computer Science, Gwangju Institute of Science and Technology (GIST), Gwangju, South Korea","['Department of Energy Engineering, Power Semiconductor Concentration, Korea Institute of Energy Technology (KENTECH), Naju, South Korea', 'Department of Chemistry, Gwangju Institute of Science and Technology (GIST), Gwangju, South Korea']"
562,"Department of Energy Engineering, Power Semiconductor Concentration, Korea Institute of Energy Technology (KENTECH), Naju, South Korea","['School of Electrical Engineering and Computer Science, Gwangju Institute of Science and Technology (GIST), Gwangju, South Korea', 'Department of Chemistry, Gwangju Institute of Science and Technology (GIST), Gwangju, South Korea']"
563,"Air Force Office of Scientific Research, Arlington (Ballston), VA, USA","['Department of Electrical and Computer Engineering, Virginia Commonwealth University, Richmond, VA, USA']"
564,"Department of Electrical and Computer Engineering, Virginia Commonwealth University, Richmond, VA, USA","['Air Force Office of Scientific Research, Arlington (Ballston), VA, USA']"
565,"Brookhaven National Laboratory, Center for Functional Nanomaterials, Upton, NY","['Materials Department, University of California at Santa Barbara, Santa Barbara, CA, USA']"
566,"Materials Department, University of California at Santa Barbara, Santa Barbara, CA, USA","['Brookhaven National Laboratory, Center for Functional Nanomaterials, Upton, NY']"
567,"Cobra Research Institute, Eindhoven University of Technology, Eindhoven, Netherlands",[]
568,"MESA Institute of Nanotechnology, University of Twente, Enschede, Netherlands",[]
569,"Department of Electronic Engineering, Tsinghua University, Beijing, China","[""Scuola Superiore Sant'' Anna, Pisa, Italy"", 'CNIT, Pisa, Italy', 'TheKey Laboratory of Semiconductor Materials Science, Institute of semiconductors, Chinese Academy and Sciences, Beijing, China']"
570,"TheKey Laboratory of Semiconductor Materials Science, Institute of semiconductors, Chinese Academy and Sciences, Beijing, China","['Department of Electronic Engineering, Tsinghua University, Beijing, China']"
571,"TFT Circuit Design Division, Semiconductor Energy Laboratory Company, Ltd., Atsugi, Japan","['VLSI Design and Education Center, University of Tokyo, Tokyo, Japan']"
572,"VLSI Design and Education Center, University of Tokyo, Tokyo, Japan","['TFT Circuit Design Division, Semiconductor Energy Laboratory Company, Ltd., Atsugi, Japan']"
573,"Semiconductor Lighting Research and Development Center, Institute of Semiconductors, Chinese Academy of Sciences, Beijing, China",[]
574,"ON Semiconductor Company, LLC., Phoenix, AZ, USA","['Center for Solid State Electronics Research, Arizona State University, Tempe, AZ, USA', 'School of Electrical and Energy Engineering, Arizona State University, Tempe, AZ, USA']"
575,"Physics Department, South Dakota School of Mines and Technology, Rapid City, SD, USA",[]
576,"University of Texas, Austin, Austin, TX, USA",[]
577,"Kanazawa University, Kanazawa, Japan","['School of Electrical and Computer Engineering, College of Science and Engineering, Kanazawa University, Kanazawa, Japan']"
578,"School of Electrical and Computer Engineering, College of Science and Engineering, Kanazawa University, Kanazawa, Japan","['Kanazawa University, Kanazawa, Japan']"
579,"State Key Discipline Laboratory of Wide Band Gap Semiconductor Technology, School of Microelectronics, Xidian University, Xi'an, China","['National Key Laboratory of ASIC, Hebei Semiconductor Research Institute, Shijiazhuang, China']"
580,"Department of Industrial Systems Engineering and Management, National University of Singapore, Singapore","['Fab 10 Data Science, Fab 10 Micron Technology, Singapore']"
581,"Fab 10 Data Science, Fab 10 Micron Technology, Singapore","['Department of Industrial Systems Engineering and Management, National University of Singapore, Singapore']"
582,"Department of Physics and Astronomy, McMaster University, Hamilton, ONT, Canada","['Centre for Electrophotonic Materials and Devices, McMaster University, Hamilton, ONT, Canada', 'Department of Engineering, McMaster University, Hamilton, ONT, Canada']"
583,"Department of Engineering, McMaster University, Hamilton, ONT, Canada","['Centre for Electrophotonic Materials and Devices, McMaster University, Hamilton, ONT, Canada', 'Department of Physics and Astronomy, McMaster University, Hamilton, ONT, Canada']"
584,"Centre for Electrophotonic Materials and Devices, McMaster University, Hamilton, ONT, Canada","['Department of Physics and Astronomy, McMaster University, Hamilton, ONT, Canada', 'Department of Engineering, McMaster University, Hamilton, ONT, Canada']"
585,"National Key Laboratory of ASIC, Hebei Semiconductor Research Institute, Hebei, China","['School of Electronic Science and Engineering, Nanjing University, Nanjing, China']"
586,"School of Electronic Science and Engineering, Nanjing University, Nanjing, China","['National Key Laboratory of ASIC, Hebei Semiconductor Research Institute, Hebei, China']"
587,"Millimeter-Wave Electronics Group, ETH Zurich, Zürich, Switzerland",[]
588,"Physics Department, Gazi University, Ankara, Turkey","['Electronics and Automation Department, Karabuk University, Karabük, Turkey', 'Department of Mechatronics Engineering, Karabük University, Karabük, Turkey']"
589,"Department of Mechatronics Engineering, Karabük University, Karabük, Turkey","['Electronics and Automation Department, Karabuk University, Karabük, Turkey', 'Physics Department, Gazi University, Ankara, Turkey']"
590,"Electronics and Automation Department, Karabuk University, Karabük, Turkey","['Physics Department, Gazi University, Ankara, Turkey', 'Department of Mechatronics Engineering, Karabük University, Karabük, Turkey']"
591,"Department of Physics, Kookmin University, Seoul, South Korea","['Nanomedical National Core Research Center, Yonsei University, Seoul, South Korea']"
592,"Nanomedical National Core Research Center, Yonsei University, Seoul, South Korea","['Department of Physics, Kookmin University, Seoul, South Korea']"
593,"Electrical Engineering Research Laboratory and Center for Compound Semiconductor Microelectronics, University of Illinois, Urbana-Champaign, Urbana, IL, USA",[]
594,"Department of Chemical and Environmental Engineering, University of Arizona Tucson, Tucson, AZ, USA",[]
595,"Nanoelectronics Research Institutes, AIST, Ibaraki, Japan",[]
596,"Department of Semiconductor Process Equipment, Semiconductor Convergence Campus, Korea Polytechnics, Anseong-si, Republic of Korea","['Korea Advanced Nano Fab Center (KANC), Suwon-si, Republic ofKorea', 'Department of Electrical and Computer Engineering, The University of Texas at Austin, Austin, TX, USA', 'Department of Semiconductor Materials and Applications, Seongnam Campus, Korea Polytechnics, Seongnam-si, Republic of Korea']"
597,"Department of Electrical and Computer Engineering, The University of Texas at Austin, Austin, TX, USA","['Department of Semiconductor Process Equipment, Semiconductor Convergence Campus, Korea Polytechnics, Anseong-si, Republic of Korea', 'Korea Advanced Nano Fab Center (KANC), Suwon-si, Republic ofKorea', 'Department of Semiconductor Materials and Applications, Seongnam Campus, Korea Polytechnics, Seongnam-si, Republic of Korea']"
598,"Department of Semiconductor Materials and Applications, Seongnam Campus, Korea Polytechnics, Seongnam-si, Republic of Korea","['Department of Semiconductor Process Equipment, Semiconductor Convergence Campus, Korea Polytechnics, Anseong-si, Republic of Korea', 'Korea Advanced Nano Fab Center (KANC), Suwon-si, Republic ofKorea', 'Department of Electrical and Computer Engineering, The University of Texas at Austin, Austin, TX, USA']"
599,"Korea Advanced Nano Fab Center (KANC), Suwon-si, Republic ofKorea","['Department of Semiconductor Process Equipment, Semiconductor Convergence Campus, Korea Polytechnics, Anseong-si, Republic of Korea', 'Department of Electrical and Computer Engineering, The University of Texas at Austin, Austin, TX, USA', 'Department of Semiconductor Materials and Applications, Seongnam Campus, Korea Polytechnics, Seongnam-si, Republic of Korea']"
600,"Advanced Technology Institute, SEPS, University of Surrey, Guildford, Surrey, UK",[]
601,"NTT Photonics Laboratories, NTT Corporation, Atsugi, Japan","['Research Institute of Electrical Communication, Tohoku University, Sendai, Japan']"
602,"Research Institute of Electrical Communication, Tohoku University, Sendai, Japan","['NTT Photonics Laboratories, NTT Corporation, Atsugi, Japan']"
603,"Electrical and Computer Engineering Department, University of Connecticut, Storrs, CT, USA",[]
604,"University of California, Santa Barbara, CA, USA","['Ultra Communications, Inc., Vista, CA, USA']"
605,"Ultra Communications, Inc., Vista, CA, USA","['University of California, Santa Barbara, CA, USA']"
606,"Frontier Collaborative Research Center, Tokyo Institute of Technology, Yokohama, Japan","['ERATO-SORST, Japan Science and Technology Agency in Frontier Collaborative Research Center, Tokyo Institute of Technology, Yokohama, Japan', 'Canon Research Center, Canon, Inc., Tokyo, Japan', 'Materials and Structures Laboratory, Tokyo Institute of Technology, Yokohama, Japan']"
607,"Canon Research Center, Canon, Inc., Tokyo, Japan","['ERATO-SORST, Japan Science and Technology Agency in Frontier Collaborative Research Center, Tokyo Institute of Technology, Yokohama, Japan', 'Frontier Collaborative Research Center, Tokyo Institute of Technology, Yokohama, Japan', 'Materials and Structures Laboratory, Tokyo Institute of Technology, Yokohama, Japan']"
608,"ERATO-SORST, Japan Science and Technology Agency in Frontier Collaborative Research Center, Tokyo Institute of Technology, Yokohama, Japan","['Canon Research Center, Canon, Inc., Tokyo, Japan', 'Frontier Collaborative Research Center, Tokyo Institute of Technology, Yokohama, Japan', 'Materials and Structures Laboratory, Tokyo Institute of Technology, Yokohama, Japan']"
609,"Materials and Structures Laboratory, Tokyo Institute of Technology, Yokohama, Japan","['ERATO-SORST, Japan Science and Technology Agency in Frontier Collaborative Research Center, Tokyo Institute of Technology, Yokohama, Japan', 'Canon Research Center, Canon, Inc., Tokyo, Japan', 'Frontier Collaborative Research Center, Tokyo Institute of Technology, Yokohama, Japan']"
610,"Department of Applied Mathematics, University College Cork, Cork, Ireland","['Weierstrass Institute of Applied Analysis and Stochastics, Berlin, Germany']"
611,"University of Glasgow, Glasgow, UK",[]
612,"School of Science and Engineering, University of Dundee, Dundee, U.K.","['Department of Physics, University of Southampton, Southampton, U.K.']"
613,"Department of Physics, University of Southampton, Southampton, U.K.","['School of Science and Engineering, University of Dundee, Dundee, U.K.']"
